QAGNAUYM,magazineArticle,2019.0,"Harris, Gareth",Liverpool World Museum used facial recognition technology on visitors to Terracotta Warriors show,The Art Newspaper,,,,https://www.theartnewspaper.com/news/liverpool-world-museum-used-facial-recognition-technology-on-visitors-to-terracotta-warriors-show,,2019-08-16,2020-02-25 13:34:36,2020-02-25 13:34:58,2020-02-25 13:34:36,,,,,,,,,,,,,,,,,,,,,,/home/diegodlh/Zotero/storage/CY98EKYB/liverpool-world-museum-used-facial-recognition-technology-on-visitors-to-terracotta-warriors-sh.html,,,,,,,,,,,,,,,,,,,,,,,,,,,,,,,,,,,,,,,,,,,,,,,,,,['White Paper Research > Areas of Focus > Privacy and sensitivity in cultural heritage management'],['White Paper Research'],False,True,False,False,False,,,,,Error: Type not supported,,Error: Type not supported,,,
NKBJH8PR,presentation,2019.0,"Okediji, Ruth",The Unfinished Business of Copyright LImitations and Exceptions,,,,,http://infojustice.org/archives/41666,,2019-10-10,2020-02-25 13:32:44,2020-02-25 13:34:04,2020-02-25 13:32:44,,,,,,,,,,,,,en-US,,,,,,,,,/home/diegodlh/Zotero/storage/XBPZIUWY/41666.html,,,,,,,,,,,,,,,,,,,,,,,,,,,,,,,,,,,,,,,,,,,,,,,,,,['White Paper Research > Areas of Focus'],['White Paper Research'],False,True,False,False,False,,,,,Error: Type not supported,,Error: Type not supported,,,American University Washington College of Law
JGN8QNK5,webpage,2019.0,"Rees, Marc",Le scan 3D du Penseur de Rodin est un document administratif communicable,Next Inpact,,,,https://www.nextinpact.com/news/107996-le-scan-3d-penseur-rodin-est-document-administratif-communicable.htm,"En mars 2019, la justice a estimé que l’interdiction de photographier les expositions temporaires au Louvre était aussi légale que justifiée. Un nouve...",2019-06-24,2019-11-06 19:47:53,2020-02-25 13:13:01,2019-11-06 19:47:53,,,,,,,,,,,,,fr,,,,,,,,,/home/diegodlh/Zotero/storage/R92KC3C2/107996-le-scan-3d-penseur-rodin-est-document-administratif-communicable.html,,,,,,,,,,,,,,,,,,,,,,,,,,,,,,,,,,,,,,,,,,,,,,,,,,[],[],False,False,False,False,False,,,,,Error: Type not supported,,Error: Type not supported,,,
SG2SPQ3N,blogPost,2020.0,"Francoise, Camille",Opening up collections in Libraries supports creativity,Library Policy and Advocacy Blog,,,,http://blogs.ifla.org/lpa/2020/01/20/opening-up-collections-in-libraries-supports-creativity/,,2020-01-20,2020-01-23 17:40:09,2020-02-25 13:12:02,2020-01-23 17:40:02,,,,,,,,,,,,,en-US,,,,,,,,,/home/diegodlh/Zotero/storage/367KNGKI/opening-up-collections-in-libraries-supports-creativity.html,,,,,,,,,,,,,,,,,,,,,,,,,,,,,,,,,,,,,,,,,,,,,,,,,,[],[],False,False,False,False,False,,,,,Error: Type not supported,,Error: Type not supported,,,
GHK6V6CY,document,,Wellcome Collection,"An ethical approach to interpreting disability and difference: Guidance from a collaboration between the Wellcome Collection and the Research Cnetre for Museums and Galleries, University of Leicester",,,,,https://le.ac.uk/rcmg/research-archive/disorder-dissent-disruption,,,2020-02-25 13:05:25,2020-02-25 13:09:51,,,,,,,,,,,,,,,,,,,,,,,/home/diegodlh/Zotero/storage/GJNHI7EK/An ethical approach to interpreting disability and.pdf,,,,,,,,,,,,,,,,,,,,,,,,,,,,,,,,,,,,,,,,,,,,,,,,,,['White Paper Research > Areas of Focus > Accessibility'],['White Paper Research'],False,True,False,False,False,,,,,Error: Type not supported,,Error: Type not supported,,,
AE9DBI2W,journalArticle,2010.0,"Proctor, Nancy","Digital: Museum as Platform, Curator as Champion, in the Age of Social Media",Curator: The Museum Journal,,2151-6952,10.1111/j.2151-6952.2009.00006.x,https://onlinelibrary.wiley.com/doi/abs/10.1111/j.2151-6952.2009.00006.x,,2010,2020-02-25 12:59:55,2020-02-25 12:59:55,2020-02-25 12:59:55,35-43,,1,53.0,,,Digital,,,,,,en,© 2010 The California Academy of Sciences,,,,Wiley Online Library,,,,"/home/diegodlh/Zotero/storage/M9LIAYRQ/Proctor - 2010 - Digital Museum as Platform, Curator as Champion, .pdf; /home/diegodlh/Zotero/storage/YJLBG3MK/j.2151-6952.2009.00006.html",,,,,,,,,,,,,,,,,,,,,,,,,,,,,,,,,,,,,,,,,,,,,,,,,,['White Paper Research > Areas of Focus'],['White Paper Research'],False,True,False,False,False,,,Error: No affiliations provided,2,10.1111/j.2151-6952.2009.00006.x,,exact,,"Digital: Museum as Platform, Curator as Champion, in the Age of Social Media",
RD8BPYEU,book,2013.0,,Writing History in the Digital Age,,978-0-472-90024-4,,,,"Writing History in the Digital Age began as a ""what-if"" experiment by posing a question: How have Internet technologies influenced how historians think, teach, author, and publish? To illustrate their answer, the contributors agreed to share the stages of their book-in-progress as it was constructed on the public web. To facilitate this innovative volume, editors Jack Dougherty and Kristen Nawrotzki designed a born-digital, open-access, and open peer review process to capture commentary from appointed experts and general readers. A customized WordPress plug-in allowed audiences to add page- and paragraph-level comments to the manuscript, transforming it into a socially networked text. The initial six-week proposal phase generated over 250 comments, and the subsequent eight-week public review of full drafts drew 942 additional comments from readers across different parts of the globe. The finished product now presents 20 essays from a wide array of notable scholars, each examining (and then breaking apart and reexamining) if and how digital and emergent technologies have changed the historical profession.",2013,2020-02-25 12:57:23,2020-02-25 12:58:14,,,,,,,,,,,,,University of Michigan Press,,,,,,,,,,/home/diegodlh/Zotero/storage/53GRW4AY/nz806057k.html,,,Cultural Studies; Digital Projects; History:Historical Methods and Theory; Media Studies:New Media,"Dougherty, Jack; Nawrotzki, Kristen",,,,,,,,,,,,,,,,,,,,,,,,,,,,,,,,,,,,,,,,,,,,,,['White Paper Research > Areas of Focus'],['White Paper Research'],False,True,False,False,False,,,Error: No affiliations provided,0,10.1353/book.27633,,35.349003,,Writing History in the Digital Age,
Y7MB6NKT,webpage,,Centre For 21st Century Humanities,"Colonial Frontier Massacres in Australia, 1788-1930",,,,,https://c21ch.newcastle.edu.au/colonialmassacres/,,,2020-02-25 12:56:50,2020-02-25 12:57:12,2020-02-25 12:56:50,,,,,,,,,,,,,,,,,,,,,,/home/diegodlh/Zotero/storage/9GAZ82D8/colonialmassacres.html,,,,,,,,,,,,,,,,,,,,,,,,,,,,,,,,,,,,,,,,,,,,,,,,,,['White Paper Research > Areas of Focus > Privacy and sensitivity in cultural heritage management'],['White Paper Research'],False,True,False,False,False,,,,,Error: Type not supported,,Error: Type not supported,,,
GVDH3IT6,book,2016.0,"Nyhan, Julianne; Flinn, Andrew",Computation and the Humanities: Towards an Oral History of Digital Humanities,,978-3-319-20169-6,,,https://www.springer.com/gp/book/9783319201696,"This book addresses the application of computing to cultural heritage and the discipline of Digital Humanities that formed around it. Digital Humanities research is transforming how the Human record can be transmitted, shaped, understood, questioned and imagined and it has been ongoing for more than 70 years. However, we have no comprehensive histories of its research trajectory or its disciplinary development. The authors make a first contribution towards remedying this by uncovering, documenting, and analysing a number of the social, intellectual and creative processes that helped to shape this research from the 1950s until the present day.By taking an oral history approach, this book explores questions like, among others, researchers’ earliest memories of encountering computers and the factors that subsequently prompted them to use the computer in Humanities research.Computation and the Humanities will be an essential read for cultural and computing historians, digital humanists and those interested in developments like the digitisation of cultural heritage and artefacts. This book is open access under a CC BY-NC 2.5 license",2016,2020-02-25 12:56:39,2020-02-25 12:56:39,2020-02-25 12:56:39,,,,,,,Computation and the Humanities,Springer Series on Cultural Computing,,,,Springer International Publishing,en,,,,,www.springer.com,,DOI: 10.1007/978-3-319-20170-2,,/home/diegodlh/Zotero/storage/EZSD2YZV/Nyhan and Flinn - 2016 - Computation and the Humanities Towards an Oral Hi.pdf; /home/diegodlh/Zotero/storage/UIH7L65V/9783319201696.html,,,,,,,,,,,,,,,,,,,,,,,,,,,,,,,,,,,,,,,,,,,,,,,,,,['White Paper Research > Areas of Focus'],['White Paper Research'],False,True,False,False,False,,,Error: No affiliations provided,4,10.1007/978-3-319-20170-2_1,Cham,71.88966,,Introduction,
MBPFBMLJ,webpage,,New Zealand Ministry for Culture and Heritage Te Manatu,Te Ara - The Encyclopedia of New Zealand,,,,,https://teara.govt.nz/en/node/168,,,2020-02-25 12:55:41,2020-02-25 12:56:03,2020-02-25 12:55:41,,,,,,,,,,,,,en,http://www.teara.govt.nz/copyright,Web page,,,,,,,/home/diegodlh/Zotero/storage/C4MXHHDI/en.html,,,,,,,,,,,,,,,,,,,,,,,,,,,,,,,,,,,,,,,,,,,,,,,,,,"['White Paper Research > Areas of Focus > Traditional knowledge, indigitization, and decolonization']",['White Paper Research'],False,True,False,False,False,,,,,Error: Type not supported,,Error: Type not supported,,,
PMCCZTG5,book,1991.0,"Wajcman, Judy",Feminism Confronts Technology,,,,,https://www.wiley.com/en-gb/Feminism+Confronts+Technology-p-9780745607788,"Feminism Confronts Technology provides a lively and engaging exploration of the impact of technology on womens lives from word processors to food processors, and genetic engineering to the design of cities. Comprehensive and critical, this book surveys the sociological and feminist literature on technology, highlighting the male bias in the way technology is defined as well as developed. Wajcman sets the scene with an overview of feminist theories of science and technology: encompassing the technologies of production and reproduction as well as domestic technology. The author challenges the common assumption that technology is gender neutral, looking at whether technology can liberate women or whether the new technologies are reinforcing sexual divisions in society.",1991-08,2020-02-25 12:54:29,2020-02-25 12:55:12,2020-02-25 12:54:29,,,,,,,,,,,,Wiley,en-gb,,,,,,,,,/home/diegodlh/Zotero/storage/53M9GWAI/Feminism+Confronts+Technology-p-9780745607788.html,,,,,,,,,,,,,,,,,,,,,,,,,,,,,,,,,,,,,,,,,,,,,,,,,,['White Paper Research > Areas of Focus'],['White Paper Research'],False,True,False,False,False,,,Error: No affiliations provided,4,10.2307/591252,,50.61248,,Feminism Confronts Technology,
2M3GDNWE,bookSection,2016.0,"Robertson, Stephen",The Differences between Digital Humanities and Digital History,Debates in the Digital Humanities,,,,https://dhdebates.gc.cuny.edu/read/untitled/section/ed4a1145-7044-42e9-a898-5ff8691b6628#ch25,Start reading this text on Manifold.,2016,2020-02-25 12:52:44,2020-02-25 12:53:55,2020-02-25 12:52:44,,,,,,,,,,,,University of Minnesota Press,en-US,,,,,,,,,/home/diegodlh/Zotero/storage/K27Y67BJ/ed4a1145-7044-42e9-a898-5ff8691b6628.html,,,,"Gold, Gold, Matthew K; Klein, Lauren F",,,,,,,,,,,,,,,,,,,,,,,,,,,,,,,,,,,,,,,,,,,,,,['White Paper Research > Areas of Focus'],['White Paper Research'],False,True,False,False,False,,,Error: No affiliations provided,2,10.5749/j.ctt1cn6thb.28,,87.92878,,The Differences between Digital Humanities and Digital History,Minneapolis
884DV8UK,bookSection,2012.0,"McPherson, Tara",Why Are the Digital Humanities So White? or Thinking the Histories of Race and Computation,Debates in the Digital Humanities,,,,https://dhdebates.gc.cuny.edu/read/untitled-88c11800-9446-469b-a3be-3fdb36bfbd1e/section/20df8acd-9ab9-4f35-8a5d-e91aa5f4a0ea,,2012,2020-02-25 12:48:28,2020-02-25 12:52:41,2020-02-25 12:48:28,,,,,,,“Chapter 9,,,,,University of Minnesota Press,en-US,,,,,,,,,/home/diegodlh/Zotero/storage/ETT58NPN/20df8acd-9ab9-4f35-8a5d-e91aa5f4a0ea.html,,,,"Gold, Matthew K",,,,,,,,,,,,,,,,,,,,,,,,,,,,,,,,,,,,,,,,,,,,,,"['White Paper Research > Areas of Focus > Traditional knowledge, indigitization, and decolonization']",['White Paper Research'],False,True,False,False,False,,,Error: No affiliations provided,2,10.5749/minnesota/9780816677948.003.0017,,121.854256,,Why Are the Digital Humanities So White? or Thinking the Histories of Race and Computation,Minneapolis
WQG4ZXNK,journalArticle,2020.0,"Gebre, Engida H; Morales, Esteban","How ""accessible"" is open data? Analysis of content-related information and users' comments in open datasets",Information and Learning Sciences,,,,https://www.emerald.com/insight/content/doi/10.1108/ILS-08-2019-0086/full/html,"This paper aims to examine the nature and sufficiency of descriptive information included in open datasets and the nature of comments and questions users write in relation to specific datasets. Open datasets are provided to facilitate civic engagement and government transparency. However, making the data available does not guarantee usage. This paper examined the nature of context-related information provided together with the datasets and identified the challenges users encounter while using the resources. Design/methodology/approach The authors extracted descriptive text provided together with (often at the top of) datasets (N = 216) and the nature of questions and comments users post in relation to the dataset. They then segmented text descriptions and user comments into “idea units” and applied open-coding with constant comparison method. This allowed them to come up with thematic issues that descriptions focus on and the challenges users encounter. Findings Results of the analysis revealed that context-related descriptions are limited and normative. Users are expected to figure out how to use the data. Analysis of user comments/questions revealed four areas of challenge they encounter: organization and accessibility of the data, clarity and completeness, usefulness and accuracy and language (spelling and grammar). Data providers can do more to address these issues. Research limitations/implications The purpose of the study is to understand the nature of open data provision and suggest ways of making open data more accessible to “non expert users”. As such, it is not focused on generalizing about open data provision in various countries as such provision may be different based on jurisdiction. Practical implications The study provides insight about ways of organizing open dataset that the resource can be accessible by the general public. It also provides suggestions about how open data providers could consider users' perspectives including providing continuous support. Originality/value Research on open data often focuses on technological, policy and political perspectives. Arguably, this is the first study on analysis of context-related information in open-datasets. Datasets do not “speak for themselves” because they require context for analysis and interpretation. Understanding the nature of context-related information in open dataset is original idea.",2020,2020-02-25 12:42:17,2020-02-25 12:43:45,,19-36,,1/2,121.0,,,,,,,,,,,,,,,,,,,,,,,,,,,,,,,,,,,,,,,,,,,,,,,,,,,,,,,,,,,,,,,,,,,,"['*WORK IN', 'ADMIN > Paywall']","['ADMIN', '*WORK IN']",False,False,False,True,True,,,Error: No affiliations provided,4,10.1108/ils-08-2019-0086,,132.75153,,How “accessible” is open data?,
CCVZR7XJ,webpage,,Te Puni Kokiri,Wai 262: Te Pae Tawhiti,Te Puni Kokiri,,,,https://www.tpk.govt.nz/en/a-matou-kaupapa/wai-262-te-pae-tawhiti/,"The Government is developing a whole-of-government approach to address the issues raised by the vast Wai 262 claim and the Waitangi Tribunal report, Ko Aotearoa Tēnei.",,2020-02-06 12:25:09,2020-02-25 12:29:47,2020-02-06 12:25:09,,,,,,,Wai 262,,,,,,en,,,,,,,,,/home/diegodlh/Zotero/storage/NDTM75PG/wai-262-te-pae-tawhiti.html,,,,,,,,,,,,,,,,,,,,,,,,,,,,,,,,,,,,,,,,,,,,,,,,,,[],[],False,False,False,False,False,,,,,Error: Type not supported,,Error: Type not supported,,,
WU64N8E2,document,2019.0,Translation Commons,Indigenous Languages Zero to Digital.pdf,,,,,https://drive.google.com/file/d/1zpZK3jfF3bDt2e5YnEw8FXSkYXSRefKu/view?usp=embed_facebook,,2019-12,2020-02-25 12:28:25,2020-02-25 12:29:14,2020-02-25 12:28:25,,,,,,,,,,,,Translation Commons,,,,,,,,,,/home/diegodlh/Zotero/storage/5N2FHNJD/view.html,,,,,,,,,,,,,,,,,,,,,,,,,,,,,,,,,,,,,,,,,,,,,,,,,,"['White Paper Research > Areas of Focus > Intangible cultural heritage', 'White Paper Research > Areas of Focus > Traditional knowledge, indigitization, and decolonization']",['White Paper Research'],False,True,False,False,False,,,,,Error: Type not supported,,Error: Type not supported,,,
S84G9XNA,newspaperArticle,2019.0,"Vulser, Nicole",Les musées face au défi de la surfréquentation,Le Monde,,,,https://www.lemonde.fr/economie/article/2019/10/29/les-musees-face-au-defi-de-la-surfrequentation_6017256_3234.html,"Billets préréservés, multiplication des points d’entrée, recours à la mécanique des fluides... les musées s’adaptent à des affluences record.",2019-10-29,2019-11-06 19:43:20,2020-02-25 12:27:53,2019-11-06 19:43:20,,,,,,,,,,,,,fr,,,,,Le Monde,,,,/home/diegodlh/Zotero/storage/5R3F2L47/les-musees-face-au-defi-de-la-surfrequentation_6017256_3234.html,,,,,,,,,,,,,,,,,,,,,,,,,,,,,,,,,,,,,,,,,,,,,,,,,,[],[],False,False,False,False,False,,,,,Error: Type not supported,,Error: Type not supported,,,
GFJA8EI6,webpage,2020.0,"Cairns, Puawai",Decolonise or indigenise: moving towards sovereign spaces and the Māorification of New Zealand museology,Museum of New Zealand Te Papa Tongarewa,,,,https://blog.tepapa.govt.nz/2020/02/10/decolonise-or-indigenise-moving-towards-sovereign-spaces-and-the-maorification-of-new-zealand-museology/,Sustainable indigenised practice in colonial museum models – is there such a thing? Kaihāpai Mātauranga Māori | Head of Mātauranga Māori Puawai Cairns explores the question.Read more,2020-02-10,2020-02-16 20:12:59,2020-02-25 12:26:29,2020-02-16 20:12:55,,,,,,,Decolonise or indigenise,,,,,,en-NZ,,,,,,,,,/home/diegodlh/Zotero/storage/UCD55JJ2/decolonise-or-indigenise-moving-towards-sovereign-spaces-and-the-maorification-of-new-zealand-m.html,,,,,,,,,,,,,,,,,,,,,,,,,,,,,,,,,,,,,,,,,,,,,,,,,,['**CITED > ALREADY CITED > Section 3'],['**CITED'],True,False,False,False,False,,,,,Error: Type not supported,,Error: Type not supported,,,
BW9J28RU,magazineArticle,2019.0,"McGivern, Hannah",How to make museums more accessible for disabled people? Ask them,The Art Newspaper,,,,http://www.theartnewspaper.com/news/how-to-make-museums-more-accessible,"Research groups have designed new technologies and initiatives for the V&A, Kunsthistorisches Museum and Thyssen-Bornemisza",2019-12-10,2019-12-11 14:11:02,2020-02-25 12:25:49,2019-12-11 14:11:02,,,,,,,How to make museums more accessible for disabled people?,,,,,,,,,,,,,,,/home/diegodlh/Zotero/storage/9QKCC3BL/how-to-make-museums-more-accessible.html,,,,,,,,,,,,,,,,,,,,,,,,,,,,,,,,,,,,,,,,,,,,,,,,,,[],[],False,False,False,False,False,,,,,Error: Type not supported,,Error: Type not supported,,,
CE8L9XAW,blogPost,2019.0,"Fauconnier, Sandra",Data Roundtripping: a new frontier for GLAM-Wiki collaborations – Wikimedia Space,Wikimedia Space,,,,https://space.wmflabs.org/2019/12/13/data-roundtripping-a-new-frontier-for-glam-wiki-collaborations/,,2019-12-13,2019-12-18 12:50:15,2020-02-25 12:25:13,2019-12-18 12:50:15,,,,,,,Data Roundtripping,,,,,,en,,,,,,,,,/home/diegodlh/Zotero/storage/3WM2LU5J/data-roundtripping-a-new-frontier-for-glam-wiki-collaborations.html,,,,,,,,,,,,,,,,,,,,,,,,,,,,,,,,,,,,,,,,,,,,,,,,,,[],[],False,False,False,False,False,,,,,Error: Type not supported,,Error: Type not supported,,,
Z9VYV3M3,webpage,,Association of Critical Heritage Studies,History,Association of Critical Heritage Studies,,,,https://www.criticalheritagestudies.org/history,,,2019-12-02 13:35:22,2020-02-25 12:24:43,2019-12-02 13:35:22,,,,,,,,,,,,,en-US,,,,,,,,,/home/diegodlh/Zotero/storage/3ZCRQP5C/history.html,,,,,,,,,,,,,,,,,,,,,,,,,,,,,,,,,,,,,,,,,,,,,,,,,,['**CITED > ALREADY CITED > Section 2'],['**CITED'],True,False,False,False,False,,,,,Error: Type not supported,,Error: Type not supported,,,
QJ2V8AME,book,2013.0,"Elster Pantalony, Rina",Managing intellectual property for museums: guide,,978-92-805-2431-4,,,,,2013,2020-02-25 12:23:18,2020-02-25 12:23:30,,,68.0,,,,,Managing intellectual property for museums,Publication / OMPI,1001E,,,WIPO,en,,,,,Gemeinsamer Bibliotheksverbund ISBN,,OCLC: 935883320,,/home/diegodlh/Zotero/storage/DF543PHR/Elster Pantalony - 2013 - Managing intellectual property for museums guide.pdf,,,,,,,,,,,,,,,,,,,,,,,2013 ed,,,,,,,,,,,,,,,,,,,,,,,,,,,[],[],False,False,False,False,False,,,Error: No affiliations provided,2,10.1111/j.1747-1796.1999.tb00058.x,,58.108345,,Canada's Database Decision,Geneva
7G2BFYJU,webpage,,IFLA,IFLA Strategy 2019-2024,,,,,https://www.ifla.org/files/assets/hq/gb/strategic-plan/ifla-strategy-2019-2024-en.pdf,,,2020-02-25 12:22:25,2020-02-25 12:22:39,2020-01-07 15:34:01,,,,,,,,,,,,,,,,,,,,,,/home/diegodlh/Zotero/storage/CQGKIN8R/ifla-strategy-2019-2024-en.pdf,,,,,,,,,,,,,,,,,,,,,,,,,,,,,,,,,,,,,,,,,,,,,,,,,,[],[],False,False,False,False,False,,,,,Error: Type not supported,,Error: Type not supported,,,
ZM7E97KU,blogPost,2018.0,"Khan, Mehtab","Traditional Knowledge and the Commons: The Open Movement, Listening, and Learning",Creative Commons,,,,https://creativecommons.org/2018/09/18/traditional-knowledge-and-the-commons-the-open-movement-listening-and-learning/,"CC licenses and public domain tools help individuals, organisations, and public institutions better disseminate digital resources and data, breaking down the typical barriers associated with traditional “all rights reserved” copyright. At the same time, CC licenses can’t do everything for everyone. First, the licenses operate in the sphere of copyright and similar rights. They do … Read More ""Traditional Knowledge and the Commons: The Open Movement, Listening, and Learning""",2018-09-18,2019-12-18 13:13:48,2020-02-25 12:22:11,2019-12-18 13:13:48,,,,,,,Traditional Knowledge and the Commons,,,,,,en-US,,,,,,,,,/home/diegodlh/Zotero/storage/EZ8DEQSD/traditional-knowledge-and-the-commons-the-open-movement-listening-and-learning.html,,,,,,,,,,,,,,,,,,,,,,,,,,,,,,,,,,,,,,,,,,,,,,,,,,[],[],False,False,False,False,False,,,,,Error: Type not supported,,Error: Type not supported,,,
4B5KD5MC,book,2016.0,,"Indigenous Notions of Ownership and Libraries, Archives and Museums",,,,,https://www.ifla.org/publications/ifla-publications-series-166,,2016,2020-01-24 01:17:13,2020-02-25 12:21:39,2020-01-24 01:17:13,,,,,,,,IFLA Publication Series,,,,De Gruyter Saur,,,,,,,,,,/home/diegodlh/Zotero/storage/Q4HXLZAX/ifla-publications-series-166.html,,,,"Callison, Camille; Roy, Loriene; LeCheminant, Gretchen Alice",,,,,,,,,,,,,,,,,,,,,,,,,,,,,,,,,,,,,,,,,,,,,,[],[],False,False,False,False,False,,,Error: No affiliations provided,2,10.1515/9783110363234-004,"Berlin, Boston",61.75914,,1. Who is Indigenous?,Berlin/Munich
3VW67ERV,document,2019.0,"Pringle, Jonathan",Northern Arizona University's Cline Library and the Protocols,,,,,https://www2.archivists.org/sites/all/files/Case_2_NAU_Cline_Library_and_Protocols.pdf,"This case study examines how Northern Arizona University’s Cline Library has responded to the Protocols for Native American Archival Materialssince their publication in 2006 and uses examples to support specific recommendations such as building relationships of mutual respect, striving for balance in content and perspectives, accessibility and use, providing context, copying and repatriation, research protocols, and awareness of issues.",2019-04,2020-02-25 12:18:50,2020-02-25 12:19:30,2020-02-25 12:18:45,,,,,,,,,,,,Society of American Archivists,,,,,,,,,,/home/diegodlh/Zotero/storage/Y8DCIKU2/Case_2_NAU_Cline_Library_and_Protocols.pdf,,,,,,,,,,,,,,,,,,,,,,,,,,,,,,,,,,,,,,,,,,,,,,,,,,"['White Paper Research > Areas of Focus > Traditional knowledge, indigitization, and decolonization']",['White Paper Research'],False,True,False,False,False,,,,,Error: Type not supported,,Error: Type not supported,,,
7WWIRY9X,document,2019.0,"Carpenter, Brian",Archival Initiatives for the Indigenous Collections at the American Phiosophical Society,,,,,https://www2.archivists.org/sites/all/files/Case_1_Archival_Initiatives_for_Indiginous_Collections.pdf,"This case study describes a series of initiatives at the American Philosophical Society Library (APS) to provide more meaningful and appropriate access to its extensive collections of Native American archival materials. These initiatives included projects to digitize and more accurately describe key parts of the collections, to assess its researcher constituencies, and to collaborate with Indigenous communities. It draws connections between these initiatives and the best practices recommendations of theProtocols for Native American Archival Materials, and describes the development and implementation of the APS’s own guidelinesfor identifying culturally sensitive materials within its collections through guidance from Indigenous communities. The case study concludes with findings on the approachability and accessibility of non-Native archives, the institutional impact of putting policies into place that draw from theProtocols, and approaches archives can take to implementing these approaches at whatever scale.",2019-02,2020-02-25 12:17:11,2020-02-25 12:18:16,2020-02-25 12:17:07,,,,,,,,,,,,Society of American Archivists,,,,,,,,,,/home/diegodlh/Zotero/storage/N7FF66DC/Case_1_Archival_Initiatives_for_Indiginous_Collections.pdf,,,,,,,,,,,,,,,,,,,,,,,,,,,,,,,,,,,,,,,,,,,,,,,,,,"['White Paper Research > Areas of Focus > Traditional knowledge, indigitization, and decolonization']",['White Paper Research'],False,True,False,False,False,,,,,Error: Type not supported,,Error: Type not supported,,,
