ZC9LFTK9,webpage,,,Physical Tactics for Digital Colonialism,Rhizome,,,,http://rhizome.org/events/physical-tactics-for-digital-colonialism/,"In the premiere of this performance-lecture, commissioned and presented by New Museum affiliate Rhizome, artist Morehshin Allahyari illuminates her concept of digital colonialism in relation to the technology of 3-D printing.",,2020-04-22 11:30:26,2020-04-22 11:30:26,2020-04-22 11:30:26,,,,,,,,,,,,,en,,,,,,,Library Catalog: rhizome.org,,/home/diegodlh/Zotero/storage/57WVW6LV/physical-tactics-for-digital-colonialism.html,,,,,,,,,,,,,,,,,,,,,,,,,,,,,,,,,,,,,,,,,,,,,,,,,,['**CITED > ALREADY CITED > Section 2'],['**CITED'],True,False,False,False,False,,,,,Error: Type not supported,,Error: Type not supported,,,
DLCTXJKP,webpage,,,Morehshin Allahyari: Physical Tactics for Digital Colonialism,,,,,https://vimeo.com/337394969,"In her February 2019 performance-lecture, commissioned and copresented by New Museum affiliate Rhizome and documented here, artist Morehshin Allahyari illuminates her concept of digital colonialism in relation to the technologies of 3-D scanning and 3-D printing.",,2020-04-22 11:30:11,2020-04-22 11:30:11,2020-04-22 11:30:11,,,,,,,Morehshin Allahyari,,,,,,en,,,,,,,Library Catalog: www.newmuseum.org,,/home/diegodlh/Zotero/storage/CATCN83A/morehshin-allahyari-physical-tactics-for-digital-colonialism.html,,,,,,,,,,,,,,,,,,,,,,,,,,,,,,,,,,,,,,,,,,,,,,,,,,['**CITED > ALREADY CITED > Section 3'],['**CITED'],True,False,False,False,False,,,,,Error: Type not supported,,Error: Type not supported,,,
X7AP8S8L,webpage,2019.0,"Naruta-Moya, Anna",Indigenous Digital Archive,,,,,http://blog.indigenousdigitalarchive.org/,,2019-06-13,2020-04-19 12:28:48,2020-04-22 11:28:42,2020-04-19 12:28:48,,,,,,,,,,,,,en,,,,,,,Library Catalog: blog.indigenousdigitalarchive.org Publisher: Anna Naruta-Moya,,/home/diegodlh/Zotero/storage/ZE84H7ZA/blog.indigenousdigitalarchive.org.html,,,,,,,,,,,,,,,,,,,,,,,,,,,,,,,,,,,,,,,,,,,,,,,,,,['**CITED > ALREADY CITED > Section 3'],['**CITED'],True,False,False,False,False,,,,,Error: Type not supported,,Error: Type not supported,,,
W797JLK7,webpage,,,Guide for Cultural and Memory Institutions to make women visible on Wikipedia,Whose Knowledge,,,,https://whoseknowledge.org/resource/glam-guide/#OpenGLAM,We are a global campaign to center the knowledge of marginalized communities (the majority of the world) on the internet.,,2020-04-22 11:26:12,2020-04-22 11:26:43,2020-04-22 11:26:12,,,,,,,,,,,,,en-US,,,,,,,Library Catalog: whoseknowledge.org,,/home/diegodlh/Zotero/storage/MFIPFQXT/glam-guide.html,,,,,,,,,,,,,,,,,,,,,,,,,,,,,,,,,,,,,,,,,,,,,,,,,,[],[],False,False,False,False,False,,,,,Error: Type not supported,,Error: Type not supported,,,
8BFSGQWZ,report,2010.0,"Airini; Anae, Melani; Mila-Schaaf, Karlo",Teu Le Va - Relationships across research and policy in Pasifika education,,,,,,,2010,2020-04-22 11:22:25,2020-04-22 11:24:36,,,,,,,,,,,,,Ministry of Education,,,,,,,,,,/home/diegodlh/Zotero/storage/27AXIPNT/Airini et al. - 2010 - Teu Le Va - Relationships across research and poli.pdf,,,,,,,,,,,,,,,,,,,,,,,,,,,,,,,,,,,,,,,,,,,,,,,,,,['*WORK IN'],['*WORK IN'],False,False,False,False,True,,,Error: No affiliations provided,2,10.3917/riss.195.0161,,48.251213,,Principes directeurs pour la recherche sur la santé dans le Pacifique ? cartographie d'une relation éthique,New Zealand
X9LYBUIR,report,2011.0,,World Report on Disability,,,,,,,2011,2020-04-22 11:19:20,2020-04-22 11:20:33,,24,,,,,,,,,,,World Health Organization,en,,,,,Zotero,,,,/home/diegodlh/Zotero/storage/Q9DD9CSA/Chan and Zoellick - World Report on Disability.pdf,,,,,,,,,,,,,,,,,,,,,,,,,,,,,,,,,,,,,,,,,,,,,,,,,,['**CITED > ALREADY CITED > Section 3'],['**CITED'],True,False,False,False,False,,,Error: No affiliations provided,0,10.1016/j.alter.2011.03.001,,26.334393,,World report on disability,
UREN9CA5,bookSection,2019.0,"Parry, Ross",How Museums Made (and Re-Made) Their Digital User,Museums and Digital Culture: New Perspectives and Research,,,,,,2019,2020-04-22 11:11:44,2020-04-22 11:13:46,,275-293,,,,,,,,,,,Springer,,,,,,,,,,,,,,"Gianni, Tula; Bowen, Jonathan",,,,,,,,,,,,,,,,,,,,,,,,,,,,,,,,,,,,,,,,,,,,,,[],[],False,False,False,False,False,,,Error: No affiliations provided,2,10.1007/978-3-319-97457-6_13,Cham,93.21197,,How Museums Made (and Re-made) Their Digital User,
ID99GC94,journalArticle,2013.0,"Parry, Ross",The End of the Beginning: Normativity in the Postdigital Museum,Museum Worlds,,"2049-6729, 2049-6737",10.3167/armw.2013.010103,https://www.berghahnjournals.com/view/journals/museum-worlds/1/1/air-mw010103.xml,,2013-07-01,2020-04-22 11:03:19,2020-04-22 11:03:19,2020-04-22 11:03:19,24-39,,1,1.0,,,The End of the Beginning,,,,,,en_US,,,,,www.berghahnjournals.com,,Publisher: Berghahn Journals,,/home/diegodlh/Zotero/storage/KQMXKW4B/air-mw010103.html; /home/diegodlh/Zotero/storage/ZH9SP3MS/Parry - 2013 - The End of the Beginning Normativity in the Postd.pdf,,,,,,,,,,,,,,,,,,,,,,,,,,,,,,,,,,,,,,,,,,,,,,,,,,['**CITED > ALREADY CITED > Section 2'],['**CITED'],True,False,False,False,False,,,Error: No affiliations provided,2,10.3167/armw.2013.010103,,exact,,The End of the Beginning,
3I9P9Y4W,report,2018.0,UK Government,Culture is Digital,,,,,https://www.gov.uk/government/publications/culture-is-digital,"Using technology to drive audience engagement, boosting the digital capability of cultural organisations and unleashing the creative potential of technology.",2018-03,2019-10-24 13:07:11,2020-04-22 10:57:15,2019-10-24 13:07:11,,,,,,,,,,,,"Department for Digital, Culture, Media & Sport",en,,,,,,,,,/home/diegodlh/Zotero/storage/XL369X3T/culture-is-digital.html; /home/diegodlh/Zotero/storage/IQ472JEH/UK Government - Culture is Digital.pdf,,,,,,,,,,,,,,,,,,,,,,,,,,,,,,,,,,,,,,,,,,,,,,,,,,['White Paper Research > Legal and Policy Measures'],['White Paper Research'],False,True,False,False,False,,,Error: No affiliations provided,4,10.15444/gmc2018.11.02.03,,20.164639,,ASSESSING THE EFFECT OF CULTURE ON SOCIAL ACCEPTABILITY OF SOCIAL MEDIA IN B2B CONTEXT: CHINESE CULTURE PERSPECTIVE,
WR5B94GH,journalArticle,2017.0,"Ng, Wendy; Ware, Syrus Marcus; Greenberg, Alyssa",Activating Diversity and Inclusion: A Blueprint for Museum Educators as Allies and Change Makers,Journal of Museum Education,,,https://doi.org/10.1080/10598650.2017.1306664,,,2017,2020-04-22 10:52:57,2020-04-22 10:54:32,,142-154,,2,42.0,,,,,,,,,,,,,,,,,,/home/diegodlh/Zotero/storage/M4I8LKNQ/Ng et al. - 2017 - Activating Diversity and Inclusion A Blueprint fo.pdf,,,,,,,,,,,,,,,,,,,,,,,,,,,,,,,,,,,,,,,,,,,,,,,,,,"['**CITED > ALREADY CITED > Section 2', '*WORK IN']","['**CITED', '*WORK IN']",True,False,False,False,True,,,Error: No affiliations provided,6,10.1080/10598650.2017.1306664,,exact,,Activating Diversity and Inclusion: A Blueprint for Museum Educators as Allies and Change Makers,
YXZVF5W4,journalArticle,2009.0,"Burri, Mira",Digital Technologies and Traditional Cultural Expressions: A Positive Look at a Difficult Relationship,International Journal of Cultural Property,,,,,,2009,2020-04-22 09:51:02,2020-04-22 09:52:03,,1-31,,1,17.0,,,,,,,,,,,,,,,,,,/home/diegodlh/Zotero/storage/8WVTT5NY/Burri - 2009 - Digital Technologies and Traditional Cultural Expr.pdf,,,,,,,,,,,,,,,,,,,,,,,,,,,,,,,,,,,,,,,,,,,,,,,,,,['**CITED > ALREADY CITED > Section 3'],['**CITED'],True,False,False,False,False,,,Error: No affiliations provided,2,10.1017/s0940739110000032,,101.877945,,Digital Technologies and Traditional Cultural Expressions: A Positive Look at a Difficult Relationship,
7RDMG2LG,book,2020.0,"D'Ignazio, Catherine; Klein, Lauren F.",Data Feminism,,,,,,,2020,2020-04-22 09:41:49,2020-04-22 09:42:42,,,,,,,,,,,,,MIT Press,,,,,,,,,,,,,,,,,,,,,,,,,,,,,,,,,,,,,,,,,,,,,,,,,,,,,,,,,,,,['**CITED > ALREADY CITED > Section 3'],['**CITED'],True,False,False,False,False,,,Error: No affiliations provided,4,10.7551/mitpress/11805.001.0001,,49.19268,,Data Feminism,"Cambridge, Massachusetts"
R2YMAK3B,book,2011.0,"Craig, Carys J.","Copyright, Communication and Culture: Towards a Relational Theory of Copyright Law",,,,,,,2011,2020-04-22 09:40:26,2020-04-22 09:40:26,,,,,,,,,,,,,Edward Elgar,,,,,,,,,,,,,,,,,,,,,,,,,,,,,,,,,,,,,,,,,,,,,,,,,,,,,,,,,,,,['**CITED > ALREADY CITED > Section 1'],['**CITED'],True,False,False,False,False,,,Error: No affiliations provided,2,10.4337/9780857933522,,65.645706,,"Copyright, Communication and Culture",
XTZML3WA,book,2017.0,"Eubanks, Virginia",Automating Inequality,,,,,,,2017,2020-04-22 09:15:30,2020-04-22 09:15:50,,,,,,,,,,,,,St. Martin's Press,,,,,,,,,,,,,,,,,,,,,,,,,,,,,,,,,,,,,,,,,,,,,,,,,,,,,,,,,,,,['**CITED > ALREADY CITED > Section 3'],['**CITED'],True,False,False,False,False,,,Error: No affiliations provided,2,10.1038/scientificamerican1118-68,,38.308773,,Automating Bias,
S8J96UG7,webpage,,"Mundy, Owen",I Know Where Your Cat LIves,,,,,https://iknowwhereyourcatlives.com/,,,2020-04-22 09:14:07,2020-04-22 09:15:30,,,,,,,,,,,,,,,,,,,,,,,,,,,,,,,,,,,,,,,,,,,,,,,,,,,,,,,,,,,,,,,,,,,,,,,,,['**CITED > ALREADY CITED > Section 3'],['**CITED'],True,False,False,False,False,,,,,Error: Type not supported,,Error: Type not supported,,,
39S2WXC8,bookSection,2009.0,"Meurer, David M.; Coombe, Rosemary J.",Digital Media and the Informational Politics of Appropriation,"Lifting: ""Theft"" in Art",,,,,,2009,2020-04-22 09:11:39,2020-04-22 09:12:55,,20-27,,,,,,,,,,,Atopia Projects,,,,,,,,,,,,,,,,,,,,,,,,,,,,,,,,,,,,,,,,,,,,,,,,,,,,,,,,,,,,['**CITED > ALREADY CITED > Section 3'],['**CITED'],True,False,False,False,False,,,Error: No affiliations provided,2,10.4324/9781315393940-15,"London ; New York : Routledge, 2017.",27.350315,,Introduction,
SVGYJQSD,blogPost,2018.0,"Dhalla, Amira",The Dangers of Being Open,Amira Dhalla,,,,https://medium.com/@amirad/the-dangers-of-being-open-b50b654fe77e,Last month I attended the Creative Commons Summit and listened to a keynote called “Open as in Dangerous” by someone I personally admire…,2018-05-07,2020-04-22 09:09:06,2020-04-22 09:09:06,2018-06-09 09:24:07,,,,,,,,,,,,,,,,,,,,,,/home/diegodlh/Zotero/storage/WG5NVMGH/the-dangers-of-being-open-b50b654fe77e.html,,,,,,,,,,,,,,,,,,,,,,,,,,,,,,,,,,,,,,,,,,,,,,,,,,['**CITED > ALREADY CITED > Section 3'],['**CITED'],True,False,False,False,False,,,,,Error: Type not supported,,Error: Type not supported,,,
PSVYQWHN,webpage,,,Indigenous Archives Collective,Indigenous Archives Collective,,,,https://indigenousarchives.net/,"Connecting people working with Indigenous knowledge sources  in Galleries, Libraries, Archives and Museums",,2020-02-25 18:08:57,2020-04-22 08:43:08,2020-02-25 18:08:57,,,,,,,,,,,,,en,,,,,,,,,/home/diegodlh/Zotero/storage/LAMRMGLQ/indigenousarchives.net.html,,,,,,,,,,,,,,,,,,,,,,,,,,,,,,,,,,,,,,,,,,,,,,,,,,"['**CITED > ALREADY CITED > Section 3', 'Practical Guidance > Cultural Sensitivities']","['Practical Guidance', '**CITED']",True,False,True,False,False,,,,,Error: Type not supported,,Error: Type not supported,,,
MZRYUK9L,book,2018.0,,Research Handbook on Contemporary Intangible Cultural Heritage,,,,,,,2018,2020-04-22 08:06:32,2020-04-22 08:07:20,,,,,,,,,,,,,Edward Elgar,,,,,,,,,,,,,,"Waelde, Charlotte; Cummings, Catherine; Pavis, Mathilde; Enright, Elena",,,,,,,,,,,,,,,,,,,,,,,,,,,,,,,,,,,,,,,,,,,,,,['**CITED > ALREADY CITED > Section 3'],['**CITED'],True,False,False,False,False,,,Error: No affiliations provided,0,10.4337/9781786434012.00011,,57.535206,,DEBATES WITHIN CONTEMPORARY INTANGIBLE CULTURAL HERITAGE,
SWLNR2BL,book,2018.0,"Reilly, Maura; Lippard, Lucy R",Curatorial activism: towards an ethic of curating,,978-0-500-23970-4,,,,"Current art world statistics demonstrate that the fight for gender and race equality in the art world is far from over: only sixteen percent of this year?s Venice Biennale artists were female; only fourteen percent of the work displayed at MoMA in 2016 was by nonwhite artists; only a third of artists represented by U.S. galleries are female, but over two-thirds of students enrolled in art and art-history programs are young women.0Arranged in thematic sections focusing on feminism, race, and sexuality, Curatorial Activism examines and illustrates pioneering examples of exhibitions that have broken down boundaries and demonstrated that new approaches are possible, from Linda Nochlin?s ?Women Artists? at LACMA in the mid-1970s to Jean-Hubert Martin?s ?Carambolages? in 2016 at the Grand Palais in Paris. Including interviews with pioneering curators such as Okwui Enwezor, Linda Nochlin, Jean-Hubert Martin, and Nan Goldin, this volume is both an invaluable source of practical information for those who understand that institutions must be a driving force in this area and a vital source of inspiration for today?s expanding new generation of curators.",2018,2020-06-15 13:03:56,2020-06-15 13:03:56,,,,,,,,Curatorial activism,,,,,,English,,,,,Open WorldCat,,OCLC: 1028019132,,,,,,,,,,,,,,,,,,,,,,,,,,,,,,,,,,,,,,,,,,,,,,,,,,,,"['**CITED > ALREADY CITED > Section 2', '**CITED > ALREADY CITED > Section 3']",['**CITED'],True,False,False,False,False,,,Error: No affiliations provided,2,10.4324/9780429496059-16,,30.468111,,Time Will Tell,
LW53GX6T,webpage,,,MoMAR,MoMAR,,,,http://momar.gallery/,"Welcome to MoMAR. An unauthorized gallery concept aimed at democratizing physical exhibition spaces, museums, and the curation of art within them. MoMAR is non-profit, non-owned, and exists in the absence of any privatized structures.",,2020-06-15 12:53:27,2020-06-15 12:53:27,2020-06-15 12:53:27,,,,,,,,,,,,,,,,,,,,Library Catalog: momar.gallery,,/home/diegodlh/Zotero/storage/R4AJ3XHR/about.html,,,,,,,,,,,,,,,,,,,,,,,,,,,,,,,,,,,,,,,,,,,,,,,,,,"['**CITED > ALREADY CITED > Section 2', '**CITED > ALREADY CITED > Section 3']",['**CITED'],True,False,False,False,False,,,,,Error: Type not supported,,Error: Type not supported,,,
AN8KGF9E,webpage,,Open Access Scholarly Publishers Association,Licensing FAQ,Open Access Scholarly Publishers Association,,,,https://oaspa.org/information-resources/frequently-asked-questions/,Licensing: Frequently Asked Questions Does membership of OASPA require a specific type of license? Why does OASPA recommend the Creative Commons licenses? Why does OASPA encourage use of the CC-BY license in particular? Does OASPA allow organisations to be members if they use any other types of Creative Commons license? Why is CC-BY preferable to CC-BY-NC?... Read full article >,,2020-04-11 14:05:43,2020-06-15 12:51:35,2020-04-01,,,,,,,,,,,,,en-GB,,,,,,,Library Catalog: oaspa.org,,/home/diegodlh/Zotero/storage/XBDGDA7Q/frequently-asked-questions.html,,,,,,,,,,,,,,,,,,,,,,,,,,,,,,,,,,,,,,,,,,,,,,,,,,['**CITED > ALREADY CITED > Section 2'],['**CITED'],True,False,False,False,False,,,,,Error: Type not supported,,Error: Type not supported,,,
YBPQTVX6,journalArticle,2019.0,"Bond, Sarah E.; Leonard, Victoria","Advancing Feminism Online. Online Tools, Visibility, and Women in Classics",Studies In Late Antiquity,,,https://doi.org/10.1525/519.2019.3.1.4,https://hcommons.org/deposits/item/hc:23429/,"Can online tools address gender bias in classics? Through two case studies, this article explores the use of crowd-sourcing in order to develop digital tools that amplify women and provide them with a firmer online identity. The first, Wikipedia.org, is already entrenched in the popular research realm, and the second, WOAH (Women of Ancient History), is currently being developed as a reference tool. Wikipedia.org is the most influential source of knowledge in the world, but it has a stubborn gender bias against women. This distortion is particularly evident in the field of classics, where prior to 2017 only 7% of biographies of classicists featured women. Here, ‘classics’ is an inclusive term, and is broadly conceived to include the field of Late Antiquity. This short article details how the Women’s Classical Committee (UK)’s Wikipedia editing initiative, #WCCWiki, and the development of WOAH, have successfully increased the visibility of women online. Consequently, it offers a model to mobilize change with few physical or financial resources, but rather facilitated by digital tools and social media. Through digital feminist activism, there is the potential to reverse the gender skew of classicists online and in the public discourse, while also creating an inclusive space that is professional, proactive, and accessible to all.",2019-07-03,2020-06-15 12:50:00,2020-06-15 12:50:00,2020-06-15 12:50:00,4-16,,1,3.0,,,,,,,,,en-US,,,,,hcommons.org,,Publisher: University of California Press,,"/home/diegodlh/Zotero/storage/MK3XKUPE/hc23429.html; /home/diegodlh/Zotero/storage/IKTF74S9/Bond y Leonard - 2019 - Advancing Feminism Online. Online Tools, Visibilit.pdf",,,,,,,,,,,,,,,,,,,,,,,,,,,,,,,,,,,,,,,,,,,,,,,,,,['**CITED > ALREADY CITED > Section 2'],['**CITED'],True,False,False,False,False,,,Error: No affiliations provided,4,10.1525/sla.2019.3.1.4,,118.281456,,Advancing Feminism Online,
URNZU4LQ,document,2012.0,ICA,Universal Declaration on Archives,,,,,https://www.ica.org/sites/default/files/UDA_June%202012_press_EN.pdf,,2012-06,2020-02-25 11:40:28,2020-06-15 12:47:16,2019-08-23 13:16:03,,,,,,,,,,,,UNESCO and ICA,,,,,,,,,,/home/diegodlh/Zotero/storage/T3DNAYEL/UDA_June 2012_press_EN.pdf,,,,,,,,,,,,,,,,,,,,,,,,,,,,,,,,,,,,,,,,,,,,,,,,,,['**CITED > ALREADY CITED > Section 2'],['**CITED'],True,False,False,False,False,,,,,Error: Type not supported,,Error: Type not supported,,,
DCMJ8I6K,bookSection,2006.0,"Guibault, Lucie",Wrapping information in contract: how does it affect the public domain?,The Future of the Public Domain,978-90-411-2435-7,,,https://www.researchgate.net/publication/241887581_Wrapping_information_in_contract_how_does_it_affect_the_public_domain,,2006,2020-06-15 12:26:55,2020-06-15 12:29:41,,87-104,,,,,,Wrapping information in contract,,,,,Kluwer Law International,English,,,,,,,,,,https://www.researchgate.net/publication/241887581_Wrapping_information_in_contract_how_does_it_affect_the_public_domain,,,"Guibault, Lucie; Hugenholtz, Bernt",,,,,,,,,,,,,,,,,,,,,,,,,,,,,,,,,,,,,,,,,,,,,,['**CITED > ALREADY CITED > Section 2'],['**CITED'],True,False,False,False,False,,,Error: No affiliations provided,2,10.11647/obp.0019.03,,58.97389,,Evaluating Directive 2001/29/EC in the Light of the Digital Public Domain,
B37AGVCX,artwork,1892.0,"Gauguin, Paul",Vahine no te vi (Woman with Mango),,,,,https://commons.wikimedia.org/wiki/File:Paul_Gauguin_126.jpg,,1892,2020-06-15 12:22:36,2020-06-15 12:24:26,2020-06-15 12:22:36,,,,,,,Tahitian,,,,,,,Public domain,,Baltimore Museum of Art,,Wikimedia Commons,,,,/home/diegodlh/Zotero/storage/97CZC3QI/FilePaul_Gauguin_126.html,,,,,,,,,,,,,,,,,,,,,,,,,,oil on canvas,Height: 72.7 cm (28.6 in); Width: 44.5 cm (17.5 in),,,,,,,,,,,,,,,,,,,,,,,['**CITED > ALREADY CITED > Section 2'],['**CITED'],True,False,False,False,False,,,,,Error: Type not supported,,Error: Type not supported,,,
J9QG9V2N,journalArticle,2011.0,"Deazley, Ronan; Sullivan, Robert","Copyright, Licenses, and Statutory Fraud",Journal of Media Law,,,,https://heinonline.org/HOL/Page?handle=hein.journals/joomaw3&id=287&div=&collection=,,2011,2020-06-15 12:18:11,2020-06-15 12:18:11,,287,,,3.0,,J. Media L.,,,,,,,,,,,,,,,,/home/diegodlh/Zotero/storage/EP73VWVD/LandingPage.html,,,,,,,,,,,,,,,,,,,,,,,,,,,,,,,,,,,,,,,,,,,,,,,,,,['**CITED > ALREADY CITED > Section 2'],['**CITED'],True,False,False,False,False,"Robert Sullivan, Emeritus Professor of Law, University College London, UK. The authors would like to thank Isabella Alexander, Ross Anderson, Sarah Green and Pauline McBride for their comments on earlier drafts of this article. The opinions stated herein are the authors' own. The usual conditions apply.","['Ronan Deazley, Professor of Law, University of Glasgow, UK;', ""Robert Sullivan, Emeritus Professor of Law, University College London, UK. The authors would like to thank Isabella Alexander, Ross Anderson, Sarah Green and Pauline McBride for their comments on earlier drafts of this article. The opinions stated herein are the authors' own. The usual conditions apply.""]","[['Ronan Deazley, Professor of Law, University of Glasgow, UK;'], ['Ronan Deazley, Professor of Law, University of Glasgow, UK;'], [""Robert Sullivan, Emeritus Professor of Law, University College London, UK. The authors would like to thank Isabella Alexander, Ross Anderson, Sarah Green and Pauline McBride for their comments on earlier drafts of this article. The opinions stated herein are the authors' own. The usual conditions apply.""], [""Robert Sullivan, Emeritus Professor of Law, University College London, UK. The authors would like to thank Isabella Alexander, Ross Anderson, Sarah Green and Pauline McBride for their comments on earlier drafts of this article. The opinions stated herein are the authors' own. The usual conditions apply.""]]",4,10.5235/175776311799280782,,92.80779,,"Copyright, Licences, and Statutory Fraud",
7UZCP8TU,blogPost,2020.0,,Cartography: A Black Woman’s Response to Museums in the Time of Racial Uprising,the incluseum,,,,https://incluseum.com/2020/06/10/cartography-a-black-womans-response-to-museums-in-the-time-of-racial-uprising/,"This blogpost is authored by Dr. Porchia Moore, who has been an Advisor and Regular Contributing Writer to The Incluseum for many years. This post in the first of what will be a 3-part series&#8230…",2020-06-10,2020-06-15 11:22:51,2020-06-15 11:22:51,2020-06-15 11:22:51,,,,,,,Cartography,,,,,,en,,,,,,,Library Catalog: incluseum.com,,/home/diegodlh/Zotero/storage/2VFZSMZ4/cartography-a-black-womans-response-to-museums-in-the-time-of-racial-uprising.html,,,,,,,,,,,,,,,,,,,,,,,,,,,,,,,,,,,,,,,,,,,,,,,,,,['*WORK IN'],['*WORK IN'],False,False,False,False,True,,,,,Error: Type not supported,,Error: Type not supported,,,
CRABBC2Q,blogPost,2020.0,"Incluseum, The",Uncovering White Supremacy Culture in Museum Work,the incluseum,,,,https://incluseum.com/2020/03/04/white-supremacy-culture-museum/,"By Hannah Heller, nikhil trivedi and Joanne Jones-Rizzi *** Introduction Before we dive in, we’ll begin with a brief example of white supremacy culture in a situation encountered by friend and col…",2020-03-04,2020-06-15 11:22:45,2020-06-15 11:22:45,2020-06-15 11:22:45,,,,,,,,,,,,,en,,,,,,,Library Catalog: incluseum.com,,/home/diegodlh/Zotero/storage/NUJMP3UR/white-supremacy-culture-museum.html,,,,,,,,,,,,,,,,,,,,,,,,,,,,,,,,,,,,,,,,,,,,,,,,,,['*WORK IN'],['*WORK IN'],False,False,False,False,True,,,,,Error: Type not supported,,Error: Type not supported,,,
YW2SY9Q9,webpage,,,"Waking Up to Wokeness (Actually, “Woke” is Over, It’s Time to Do the Work): An Open Letter to Museum Peers",MASS Action,,,,https://www.museumaction.org/massaction-blog/2020/6/12/waking-up-to-wokeness-actually-woke-is-over-its-time-to-do-the-work,"Dear Museum Peers:   Over the course of the past few weeks museums have entered (read: tripped, stumbled, belly- flopped) into a several decades-old discourse on the role of race in American society. I should correct, *some* museums have just discovered that racism still dictates American society. M",,2020-06-15 11:22:06,2020-06-15 11:22:06,2020-06-15 11:22:06,,,,,,,"Waking Up to Wokeness (Actually, “Woke” is Over, It’s Time to Do the Work)",,,,,,en-US,,,,,,,Library Catalog: www.museumaction.org,,/home/diegodlh/Zotero/storage/U26YQBC4/waking-up-to-wokeness-actually-woke-is-over-its-time-to-do-the-work.html,,,,,,,,,,,,,,,,,,,,,,,,,,,,,,,,,,,,,,,,,,,,,,,,,,['*WORK IN'],['*WORK IN'],False,False,False,False,True,,,,,Error: Type not supported,,Error: Type not supported,,,
WLEWZXUI,document,2017.0,,MASS Action Toolkit,,,,,,,2017,2020-06-15 11:15:42,2020-06-15 11:16:11,,,,,,,,,,,,,,,,,,,,,,,/home/diegodlh/Zotero/storage/LL8XXYSF/TOOLKIT_10_2017.pdf,,,,,,,,,,,,,,,,,,,,,,,,,,,,,,,,,,,,,,,,,,,,,,,,,,['*WORK IN'],['*WORK IN'],False,False,False,False,True,,,,,Error: Type not supported,,Error: Type not supported,,,
8MWUNC5K,webpage,,,the incluseum,the incluseum,,,,https://incluseum.com/,"We build community around issues of inclusion and justice in museums and offer a platform for critical dialogue that advances the ways in which we understand, talk about, and enact inclusion in museums.",,2020-06-15 11:14:34,2020-06-15 11:14:34,2020-06-15 11:14:34,,,,,,,,,,,,,en,,,,,,,Library Catalog: incluseum.com,,/home/diegodlh/Zotero/storage/QJDYHA9X/incluseum.com.html,,,,,,,,,,,,,,,,,,,,,,,,,,,,,,,,,,,,,,,,,,,,,,,,,,['*WORK IN'],['*WORK IN'],False,False,False,False,True,,,,,Error: Type not supported,,Error: Type not supported,,,
RFZUZEWM,webpage,,,"Puawai Cairns, Author at Te Papa’s Blog",Te Papa’s Blog,,,,https://blog.tepapa.govt.nz/author/puawai2011/,,,2020-06-15 11:12:35,2020-06-15 11:12:35,2020-06-15 11:12:35,,,,,,,,,,,,,en-NZ,,,,,,,Library Catalog: blog.tepapa.govt.nz,,/home/diegodlh/Zotero/storage/BIAPLPP4/puawai2011.html,,,,,,,,,,,,,,,,,,,,,,,,,,,,,,,,,,,,,,,,,,,,,,,,,,['*WORK IN'],['*WORK IN'],False,False,False,False,True,,,,,Error: Type not supported,,Error: Type not supported,,,
V24QASH6,webpage,,,Let's Face It! Museums Need Antiracist Policies,Museum Hue,,,,https://www.museumhue.com/blog/lets-face-it,"Let’s face it! Museums need antiracist policies (measures that produce or sustain equity between racial groups) to interrupt the pervasive effects of racism in the field. In the US, racialization is the foundation of most everything and infuses many issues, so we must first take into account race. C",,2020-06-15 11:12:18,2020-06-15 11:12:18,2020-06-15 11:12:18,,,,,,,,,,,,,en-US,,,,,,,Library Catalog: www.museumhue.com,,/home/diegodlh/Zotero/storage/76SRJDML/lets-face-it.html,,,,,,,,,,,,,,,,,,,,,,,,,,,,,,,,,,,,,,,,,,,,,,,,,,['*WORK IN'],['*WORK IN'],False,False,False,False,True,,,,,Error: Type not supported,,Error: Type not supported,,,
