7SLCM6FS,journalArticle,,"Jennifer Woodcock-Medicine Horse, PhD",GREEN MUSEUMS WAKING UP THE WORLD: INDIGENOUS AND MAINSTREAM APPROACHES TO EXPLORING SUSTAINABILITY,,,,,https://www.academia.edu/37809479/GREEN_MUSEUMS_WAKING_UP_THE_WORLD_INDIGENOUS_AND_MAINSTREAM_APPROACHES_TO_EXPLORING_SUSTAINABILITY,"Mainstream and Indigenous Museums are ideally situated, both geographically and culturally, to educate the public about complex twenty-first century environmental issues. The most effective approaches to understanding, addressing, and adapting to",,2020-04-20 13:56:23,2020-04-20 13:56:23,2020-04-20 13:56:23,,,,,,,GREEN MUSEUMS WAKING UP THE WORLD,,,,,,en,,,,,www.academia.edu,,,,/home/diegodlh/Zotero/storage/FJ4GJLRE/GREEN_MUSEUMS_WAKING_UP_THE_WORLD_INDIGENOUS_AND_MAINSTREAM_APPROACHES_TO_EXPLORING_SUSTAINABIL.html,,,,,,,,,,,,,,,,,,,,,,,,,,,,,,,,,,,,,,,,,,,,,,,,,,['ADMIN > New Resource Dump'],['ADMIN'],False,False,False,True,False,Department of Journalism & Communication Studies; Long Island University Brooklyn; New York NY 11201 USA,['Department of Journalism & Communication Studies; Long Island University Brooklyn; New York NY 11201 USA'],"[['Department of Journalism & Communication Studies; Long Island University Brooklyn; New York NY 11201 USA'], ['Department of Journalism & Communication Studies; Long Island University Brooklyn; New York NY 11201 USA']]",2,10.1111/cccr.12068,,28.18205,,Exploring the Alternative-Mainstream Dialectic: What “Alternative Media” Means to a Hybrid Audience,
NBSEKGV2,webpage,2017.0,,Strategy/Wikimedia movement/2017/Direction,Wikimedia Meta-Wiki,,,,https://meta.wikimedia.org/wiki/Strategy/Wikimedia_movement/2017/Direction,,2017,2020-04-20 11:14:45,2020-04-20 11:15:30,,,,,,,,,,,,,,,,,,,,,,,,,,,,,,,,,,,,,,,,,,,,,,,,,,,,,,,,,,,,,,,,,,,,,,,,,['**CITED > ALREADY CITED > Section 2'],['**CITED'],True,False,False,False,False,,,,,Error: Type not supported,,Error: Type not supported,,,
F38ZN853,journalArticle,2012.0,"Fiormonte, Domenico",Towards a Cultural Critique of the Digital Humanities,Historical Social Research / Historische Sozialforschung,,0172-6404,,https://www.jstor.org/stable/41636597,"In this article I try to articulate a critical assessment of the current geopolitical assets of Digital Humanities. This critique is based firstly on data about the composition of various government organs, institutions and the principal journals in the field, and secondly on a general reflection on the cultural, political and linguistic bias of digital standards, protocols and interfaces. These reflections suggest that DH is not only a discipline and an academic discourse dominated materially by an Anglo-American élite and intellectually by a mono-cultural view, but also that it lacks a theoretical model for reflecting critically on its own instruments. I conclude by proposing the elaboration of a different model of DH, based on the concept of knowledge as a commons and the cultivation of cultural margins, as opposed to its present obsession with large-scale digitization projects and ""archiving fever,"" that leads to an increase in our dependency on the products of private industry and, of course, on their funding.",2012,2020-04-20 11:10:45,2020-04-20 11:10:45,2020-04-20 11:10:45,59-76,,3 (141),37.0,,,,,,,,,,,,JSTOR,,JSTOR,,"Publisher: GESIS - Leibniz-Institute for the Social Sciences, Center for Historical Social Research",,,,,,,,,,,,,,,,,,,,,,,,,,,,,,,,,,,,,,,,,,,,,,,,,,,,['**CITED > ALREADY CITED > Section 2'],['**CITED'],True,False,False,False,False,,,Error: No affiliations provided,2,10.1163/1569206041551663,,31.798573,,Towards a Critique of the Category of Totalitarianism,
4QUN5K8W,bookSection,2014.0,"Sanderhoff, Merete",This belongs to you: On openness and sharing at Statens Museum for Kunst,Sharing is Caring: Openness and sharing in the cultural heritage sector,,,,,,2014,2020-04-20 10:12:36,2020-04-20 10:41:16,,20-131,,,,,,,,,,,"Statens Museum for Kunst, Copenhagen",,,,,,,,,,,,,,"Sanderhoff, Merete",,,,,,,,,,,,,,,,,,,,,,,,,,,,,,,,,,,,,,,,,,,,,,['**CITED > ALREADY CITED > Section 1'],['**CITED'],True,False,False,False,False,Institute of Health and Society; University of Oslo; Oslo Norway,['Department of Global Public Health and Primary Care; University of Bergen; Bergen Norway'],"[['Research Network on Integrated Health Care in Western Norway; Helse Fonna Local Health Authority; Haugesund Norway', 'Department of Global Public Health and Primary Care; University of Bergen; Bergen Norway'], ['Research Network on Integrated Health Care in Western Norway; Helse Fonna Local Health Authority; Haugesund Norway', 'Department of Global Public Health and Primary Care; University of Bergen; Bergen Norway'], ['Department of Global Public Health and Primary Care; University of Bergen; Bergen Norway', 'Research Unit for General Practice; Uni Health; Uni Research; Bergen Norway'], ['Department of Global Public Health and Primary Care; University of Bergen; Bergen Norway', 'Research Unit for General Practice; Uni Health; Uni Research; Bergen Norway'], ['Institute of Health and Society; University of Oslo; Oslo Norway', 'Department of Neurology; Oslo University Hospital; Oslo Norway', 'Global Health Leadership Institute; School of Public Health; Yale University; New Haven CT USA'], ['Institute of Health and Society; University of Oslo; Oslo Norway', 'Department of Neurology; Oslo University Hospital; Oslo Norway', 'Global Health Leadership Institute; School of Public Health; Yale University; New Haven CT USA']]",6,10.1111/scs.12098,,21.960564,,Caregiver roles in families affected by Huntington's disease: a qualitative interview study,
82ECESKH,bookSection,2014.0,"von Haller Grønbæk, Martin; Sanderhoff, Merete",GLAMourous remix: Openness and sharing for cultural institutions,Sharing is Caring: Openness and sharing in the cultural heritage sector,,,,,,2014,2020-04-20 10:22:10,2020-04-20 10:23:33,,141-153,,,,,,,,,,,"Statens Museum for Kunst, Copenhagen",,,,,,,,,,,,,,,,,,,,,,,,,,,,,,,,,,,,,,,,,,,,,,,,,,,,,,,,,,,,['**CITED > ALREADY CITED > Section 2'],['**CITED'],True,False,False,False,False,,,Error: No affiliations provided,2,10.29085/9781783302505.006,,54.75296,,"Small steps, big impact – how SMK became SMK Open",
PG9G4J3E,journalArticle,2005.0,"Hamma, Kenneth",Public Domain Art in an Age of Easier Mechanical Reproducibility,D-Lib Magazine,,,,http://www.dlib.org/dlib/november05/hamma/11hamma.html,,2005,2019-11-03 21:29:24,2020-04-20 10:07:26,2016-12-02 19:39:56,,,11,11.0,,,,,,,,,,,,,,,,,,/home/diegodlh/Zotero/storage/MQMH6R6E/11hamma.html,,,,,,,,,,,,,,,,,,,,,,,,,,,,,,,,,,,,,,,,,,,,,,,,,,"['**CITED > ALREADY CITED > Section 1', '**CITED > ALREADY CITED > Section 2', 'White Paper Research > A Time for Revision']","['White Paper Research', '**CITED']",True,True,False,False,False,,,Error: No affiliations provided,2,10.1045/november2005-hamma,,103.39078,,Public Domain Art in an Age of Easier Mechanical Reproducibility,
NWQP8ND8,bookSection,2007.0,"Mason, Ingrid",Cultural Information Standards—Political Territory and Rich Rewards,Theorizing Digital Cultural Heritage: A Critical Discourse,,,,,,2007,2020-04-20 09:43:13,2020-04-20 09:45:56,,,,,,,,,,,,,MIT Press,,,,,,,,,,,,,,"Cameron, Fiona; Kenderdine, Sarah",,,,,,,,,,,,,,,,,,,,,,,,,,,,,,,,,,,,,,,,,,,,,,['**CITED > ALREADY CITED > Section 3'],['**CITED'],True,False,False,False,False,,,Error: No affiliations provided,2,10.7551/mitpress/9780262033534.003.0012,,110.37285,,Cultural Information Standards—Political Territory and Rich Rewards,"Cambridge, Massachusetts"
6TUDX8YR,bookSection,2007.0,"Cameron, Fiona; Robinson, Helena","Digital Knowledgescapes: Cultural. Theoretical, Practical, and Usage Issues Facing Museum Collection Databases in a Digital Epoch",Theorizing Digital Cultural Heritage: A Critical Discourse,,,,,,2007,2020-04-20 09:35:25,2020-04-20 09:45:35,,165-191,,,,,,,,,,,MIT Press,,,,,,,,,,,,,,"Cameron, Fiona; Kenderdine, Sarah",,,,,,,,,,,,,,,,,,,,,,,,,,,,,,,,,,,,,,,,,,,,,,['**CITED > ALREADY CITED > Section 3'],['**CITED'],True,False,False,False,False,,,Error: No affiliations provided,4,10.7551/mitpress/9780262033534.003.0010,,171.30264,,"Digital Knowledgescapes: Cultural, Theoretical, Practical, and Usage Issues Facing Museum Collection Databases in a Digital Epoch","Cambridge, Massachusetts"
ZRARJW7L,book,2007.0,"Cameron, Fiona; Kenderdine, Sarah",Theorizing Digital Cultural Heritage: A Critical Discourse,,,,,https://mitpress.mit.edu/books/theorizing-digital-cultural-heritage,"Theoretical and practical perspectives from a range of disciplines on the challenges of using digital media in interpretation and representation of cultural heritage.                 In Theorizing Digital Cultural Heritage, experts offer a critical and theoretical appraisal of the uses of digital media by cultural heritage institutions. Previous discussions of cultural heritage and digital technology have left the subject largely unmapped in terms of critical theory; the essays in this volume offer this long-missing perspective on the challenges of using digital media in the research, preservation, management, interpretation, and representation of cultural heritage. The contributors—scholars and practitioners from a range of relevant disciplines—ground theory in practice, considering how digital technology might be used to transform institutional cultures, methods, and relationships with audiences. The contributors examine the relationship between material and digital objects in collections of art and indigenous artifacts; the implications of digital technology for knowledge creation, documentation, and the concept of authority; and the possibilities for ""virtual cultural heritage""—the preservation and interpretation of cultural and natural heritage through real-time, immersive, and interactive techniques.The essays in Theorizing Digital Cultural Heritage will serve as a resource for professionals, academics, and students in all fields of cultural heritage, including museums, libraries, galleries, archives, and archaeology, as well as those in education and information technology. The range of issues considered and the diverse disciplines and viewpoints represented point to new directions for an emerging field.                     Contributors                     Nadia Arbach, Juan Antonio Barceló, Deidre Brown, Fiona Cameron, Erik Champion, Sarah Cook, Jim Cooley, Bharat Dave, Suhas Deshpande, Bernadette Flynn, Maurizio Forte, Kati Geber, Beryl Graham, Susan Hazan, Sarah Kenderdine, José Ripper Kós, Harald Kraemer, Ingrid Mason, Gavan McCarthy, Slavko Milekic, Rodrigo Paraizo, Ross Parry, Scot T. Refsland, Helena Robinson, Angelina Russo, Corey Timpson, Marc Tuters, Peter Walsh, Jerry Watkins, Andrea Witcomb",2007,2019-11-03 21:27:00,2020-04-20 09:45:28,2018-09-03 10:17:34,,,,,,,,,,,,The MIT Press,en,,,,,,,,,/home/diegodlh/Zotero/storage/X3CEW4T9/theorizing-digital-cultural-heritage.html,,,,,,,,,,,,,,,,,,,,,,,,,,,,,,,,,,,,,,,,,,,,,,,,,,['**CITED > ALREADY CITED > Section 3'],['**CITED'],True,False,False,False,False,,,Error: No affiliations provided,4,10.7551/mitpress/9780262033534.003.0001,,99.522484,,Introduction,"Cambridge, Massachusetts"
N2KD6YAC,document,2003.0,,UNESCO Charter on the Preservation of Digital Heritage,,,,,http://portal.unesco.org/en/ev.php-URL_ID=17721&URL_DO=DO_TOPIC&URL_SECTION=201.html,,2003,2020-04-20 08:58:06,2020-04-20 08:58:50,2020-04-20 08:58:06,,,,,,,,,,,,"United Nations Educational, Scientific and Cultural Organization",,,,,,,,,,/home/diegodlh/Zotero/storage/JLEAQIAF/ev.php-URL_ID=17721&URL_DO=DO_TOPIC&URL_SECTION=201.html,,,,,,,,,,,,,,,,,,,,,,,,,,,,,,,,,,,,,,,,,,,,,,,,,,[],[],False,False,False,False,False,,,,,Error: Type not supported,,Error: Type not supported,,,
7HP9889A,book,1997.0,,The Wired Museum: Emerging Technology and Changing Paradigms,,978-0-931201-36-3,,,,"Emerging technology in the field of telecommunications-the Internet and related applications-affects the way we receive and transmit information of all kinds. How will these new technologies affect museums' missions, operations, and even definitions, both now and in the near future? With chapters on online networks, digitization of collections, cultural intellectual property, public access, finance, management, and more, experts in the fields of museums and communications offer their analyses of the emerging information technology and the opportunities and challenges these changes present for museums.",1997-12-31,2020-04-20 08:46:29,2020-04-20 08:49:40,,,250.0,,,,,The Wired Museum,,,,,American Association of Museums,English,,,,,,,,,,https://www.amazon.co.uk/Wired-Museum-Emerging-Technology-Paradigms/dp/0931201365/ref=olp_product_details?ie=UTF8&me=&qid=1576425046&sr=8-1-fkmr0,,,"Jones-Garmil, Katherine",,,,,,,,,,,,,,,,,,,,,,,,,,,,,,,,,,,,,,,,,,,,,,['**CITED > ALREADY CITED > Section 3'],['**CITED'],True,False,False,False,False,,,Error: No affiliations provided,2,10.1017/s0003598x00085495,,32.97451,,Changing paradigms in museum archaeology,"Washington, DC"
U8IYYKG9,book,2010.0,"Cameron, Fiona; Kenderdine, Sarah; Thorburn, David; Barrett, Edward; Jenkins, Henry",Theorizing Digital Cultural Heritage: A Critical Discourse,,978-0-262-51411-8,,,,"Theoretical and practical perspectives from a range of disciplines on the challenges of using digital media in interpretation and representation of cultural heritage. In Theorizing Digital Cultural Heritage, experts offer a critical and theoretical appraisal of the uses of digital media by cultural heritage institutions. Previous discussions of cultural heritage and digital technology have left the subject largely unmapped in terms of critical theory; the essays in this volume offer this long-missing perspective on the challenges of using digital media in the research, preservation, management, interpretation, and representation of cultural heritage. The contributors-scholars and practitioners from a range of relevant disciplines-ground theory in practice, considering how digital technology might be used to transform institutional cultures, methods, and relationships with audiences. The contributors examine the relationship between material and digital objects in collections of art and indigenous artifacts; the implications of digital technology for knowledge creation, documentation, and the concept of authority; and the possibilities for ""virtual cultural heritage""-the preservation and interpretation of cultural and natural heritage through real-time, immersive, and interactive techniques. The essays in Theorizing Digital Cultural Heritage will serve as a resource for professionals, academics, and students in all fields of cultural heritage, including museums, libraries, galleries, archives, and archaeology, as well as those in education and information technology. The range of issues considered and the diverse disciplines and viewpoints represented point to new directions for an emerging field. Contributors Nadia Arbach, Juan Antonio Barcelo, Deidre Brown, Fiona Cameron, Erik Champion, Sarah Cook, Jim Cooley, Bharat Dave, Suhas Deshpande, Bernadette Flynn, Maurizio Forte, Kati Geber, Beryl Graham, Susan Hazan, Sarah Kenderdine, Jose Ripper Kos, Harald Kraemer, Ingrid Mason, Gavan McCarthy, Slavko Milekic, Rodrigo Paraizo, Ross Parry, Scot T. Refsland, Helena Robinson, Angelina Russo, Corey Timpson, Marc Tuters, Peter Walsh, Jerry Watkins, Andrea Witcomb",2010-04-07,2020-04-20 08:47:02,2020-04-20 08:47:02,,,480.0,,,,,Theorizing Digital Cultural Heritage,,,,,MIT Press,English,,,,,Amazon,,,,,https://www.amazon.co.uk/Theorizing-Digital-Cultural-Heritage-Transition/dp/0262514117,,,,,,,,,,,,,,,,,,,,,,,,,,,,,,,,,,,,,,,,,,,,,,,,,[],[],False,False,False,False,False,,,Error: No affiliations provided,4,10.7551/mitpress/9780262033534.003.0001,,94.87767,,Introduction,"Cambridge, Mass. London"
VBNE7M2E,journalArticle,2005.0,"Isaacman, Allen; Lalu, Premesh; Nygren, Thomas","Digitization, History, and the Making of a Postcolonial Archive of Southern African Liberation Struggles: The Aluka Project",Africa Today,,0001-9887,,https://www.jstor.org/stable/4187703,"This paper describes the history of an initiative to digitize a postcolonial archive on the struggle for freedom in Southern Africa. The authors outline the intellectual architecture of the project and the complex epistemological, political, and technical challenges that they confronted in their endeavor to construct a digital archive that might help reorient scholarly debates on the struggle for liberation.",2005,2020-04-19 12:19:45,2020-04-19 12:19:45,2020-04-19 12:19:45,55-77,,2,52.0,,,"Digitization, History, and the Making of a Postcolonial Archive of Southern African Liberation Struggles",,,,,,,,,JSTOR,,JSTOR,,Publisher: Indiana University Press,,,,,,,,,,,,,,,,,,,,,,,,,,,,,,,,,,,,,,,,,,,,,,,,,,,,['**CITED > ALREADY CITED > Section 3'],['**CITED'],True,False,False,False,False,,,Error: No affiliations provided,6,10.2979/aft.2005.52.2.54,,163.49994,,"Digitization, History, and the Making of a Postcolonial Archive of Southern African Liberation Struggles: The Aluka Project",
CAC895MZ,webpage,2008.0,,"JSTOR and Aluka Unite, Deepening Commitment in Africa | Wayne State University Libraries",Wayne State Universities,,,,https://library.wayne.edu/blog/eresources/2008/08/04/jstor-and-aluka-unite-deepening-commitment-in-africa/,,2008-08-04,2020-04-19 12:16:48,2020-04-19 12:17:15,2020-04-19 12:16:48,,,,,,,,,,,,,,,,,,,,,,/home/diegodlh/Zotero/storage/TG7HI29I/jstor-and-aluka-unite-deepening-commitment-in-africa.html,,,,,,,,,,,,,,,,,,,,,,,,,,,,,,,,,,,,,,,,,,,,,,,,,,['**CITED > ALREADY CITED > Section 3'],['**CITED'],True,False,False,False,False,,,,,Error: Type not supported,,Error: Type not supported,,,
ZYZRFLC3,webpage,,"Koh, Adeline; Risam, Roopika",Why Rewrite Wikipedia? The Rewriting Wikipedia Project,Postcolonial Digital Humanities,,,,https://dhpoco.org/rewriting-wikipedia/,"Why Rewrite Wikipedia? by Adeline Koh and Roopika Risam Ever been disappointed by the level of Wikipedia coverage on the world outside of Europe and the United States? Our website, Postcolonial Dig...",,2020-04-19 10:42:46,2020-04-19 10:43:46,2020-04-19 10:42:46,,,,,,,,,,,,,en-US,,,,,,,Library Catalog: dhpoco.org,,/home/diegodlh/Zotero/storage/5KGKGRDU/rewriting-wikipedia.html,,,,,,,,,,,,,,,,,,,,,,,,,,,,,,,,,,,,,,,,,,,,,,,,,,['**CITED > ALREADY CITED > Section 2'],['**CITED'],True,False,False,False,False,,,,,Error: Type not supported,,Error: Type not supported,,,
M6H7N837,webpage,,"Middleton, Kim",Remix,Digital Pedagogy in the Humanities,,,,https://digitalpedagogy.mla.hcommons.org/keywords/remix/,"Concepts, Models, and Experiments",,2020-04-19 10:35:49,2020-04-19 10:38:21,2020-04-19 10:35:49,,,,,,,,,,,,,en-US,,,,,,,Library Catalog: digitalpedagogy.mla.hcommons.org,,/home/diegodlh/Zotero/storage/BXXLFM9R/remix.html,,,,,,,,,,,,,,,,,,,,,,,,,,,,,,,,,,,,,,,,,,,,,,,,,,['**CITED > ALREADY CITED > Introductory Materials'],['**CITED'],True,False,False,False,False,,,,,Error: Type not supported,,Error: Type not supported,,,
IE6DGXCI,webpage,,,Global Outlook::Digital Humanities | Promoting collaboration among Digital Humanities researchers world-wide,,,,,http://www.globaloutlookdh.org/,,,2020-04-19 10:14:16,2020-04-19 10:16:10,2020-04-19 10:14:16,,,,,,,Global Outlook,,,,,,en-US,,,,,,,Library Catalog: www.globaloutlookdh.org,,/home/diegodlh/Zotero/storage/IRDYNDZI/www.globaloutlookdh.org.html,,,,,,,,,,,,,,,,,,,,,,,,,,,,,,,,,,,,,,,,,,,,,,,,,,['**CITED > ALREADY CITED > Section 2'],['**CITED'],True,False,False,False,False,,,,,Error: Type not supported,,Error: Type not supported,,,
UMBS8TPN,bookSection,2018.0,"Harle, Josh","Digital Capture: Photogrammetry as Rhetoric, Fiction, and Relic",Decolonising the Digital: Technology as Cultural Practice,,,,,,2018,2020-04-18 16:15:41,2020-04-18 16:15:41,,49-66,,,,,,,,,,,Tactical Space Lab,,,,,,,,,,,,,,"Harle, Josh; Abdila, Angie; Newman, Andrew",,,,,,,,,,,,,,,,,,,,,,,,,,,,,,,,,,,,,,,,,,,,,,"['**CITED > ALREADY CITED > Section 2', '**CITED > ALREADY CITED > Section 3']",['**CITED'],True,False,False,False,False,,,Error: No affiliations provided,2,10.1163/9789004279148_004,,31.027855,,Dazzled by Digital?: Research Environments in African Universities and Their Implications for the Use of Digital Resources,Sydney
JKVVFE2G,bookSection,2018.0,"Nasser, Ramsey",A Personal Computer for Children of All Cultures,Decolonising the Digital: Technology as Cultural Practice,,,,,,2018,2020-04-18 16:07:22,2020-04-18 16:13:20,,21-36,,,,,,,,,,,Tactical Space Lab,,,,,,,,,,,,,,"Harle, Josh; Abdila, Angie; Newman, Andrew",,,,,,,,,,,,,,,,,,,,,,,,,,,,,,,,,,,,,,,,,,,,,,['**CITED > ALREADY CITED > Section 2'],['**CITED'],True,False,False,False,False,,,Error: No affiliations provided,2,10.26419/int.00001.007,,25.027756,,"Plan Well, Live Well: AARP Eyes Financial Resilience for All",Sydney
MMRYEWZ5,blogPost,2019.0,"Smith, Koven",At what cost?,Koven J. Smith,,,,https://kovenjsmith.com/post/the-values-of-museum-technology/,"In an article originally published in Museum magazine, I argue that museums' increased use of digital solutions provided by third parties is proving to have unintended consequences for the sector as a whole.",2019,2020-04-18 15:43:21,2020-04-18 15:44:08,2020-04-18 15:43:21,,,,,,,,,,,,,en-us,,,,,,,Library Catalog: kovenjsmith.com,,/home/diegodlh/Zotero/storage/ZX5NFG24/the-values-of-museum-technology.html,,,,,,,,,,,,,,,,,,,,,,,,,,,,,,,,,,,,,,,,,,,,,,,,,,['**CITED > ALREADY CITED > Section 2'],['**CITED'],True,False,False,False,False,,,,,Error: Type not supported,,Error: Type not supported,,,
L8XP8WTV,journalArticle,2013.0,"Kornai, András",Digital Language Death,PLoS ONE,,1932-6203,10.1371/journal.pone.0077056,https://www.ncbi.nlm.nih.gov/pmc/articles/PMC3805564/,"Of the approximately 7,000 languages spoken today, some 2,500 are generally considered endangered. Here we argue that this consensus figure vastly underestimates the danger of digital language death, in that less than 5% of all languages can still ascend to the digital realm. We present evidence of a massive die-off caused by the digital divide.",2013-10-22,2020-04-18 15:40:08,2020-04-18 15:40:08,2020-04-18 15:40:08,,,10,8.0,,PLoS One,,,,,,,,,,,,PubMed Central,,PMID: 24167559 PMCID: PMC3805564,,/home/diegodlh/Zotero/storage/9IMTNGRS/Kornai - 2013 - Digital Language Death.pdf; ,https://www.ncbi.nlm.nih.gov/pmc/articles/PMC3805564/,,,,,,,,,,,,,,,,,,,,,,,,,,,,,,,,,,,,,,,,,,,,,,,,,['**CITED > ALREADY CITED > Section 3'],['**CITED'],True,False,False,False,False,,,Error: No affiliations provided,2,10.1371/journal.pone.0077056,,exact,,Digital Language Death,
MH6XDF2V,webpage,,,the-incluseum/anti-oppressive-spaces,GitHub,,,,https://github.com/the-incluseum/anti-oppressive-spaces,"Resources for the 2016 Museum Computer Network panel ""Creating Anti-Oppressive Spaces Online"" - the-incluseum/anti-oppressive-spaces",,2020-04-18 15:37:23,2020-04-18 15:37:23,2020-04-18 15:37:23,,,,,,,,,,,,,en,,,,,,,Library Catalog: github.com,,/home/diegodlh/Zotero/storage/NZ2DRNGN/checklist-organizational.html,,,,,,,,,,,,,,,,,,,,,,,,,,,,,,,,,,,,,,,,,,,,,,,,,,['**CITED > ALREADY CITED > Section 3'],['**CITED'],True,False,False,False,False,,,,,Error: Type not supported,,Error: Type not supported,,,
8UT4KIPR,report,2016.0,"Lackoi, Krisztina; Patsou, Maria; Chatterjee, Helen","Museums for Health and Wellbeing. A Preliminary Report from the National Alliance for Museums, Health and Wellbeing",,,,,https://museumsandwellbeingalliance.files.wordpress.com/2015/07/museums-for-health-and-wellbeing.pdf,,2016,2020-04-18 15:29:14,2020-04-18 15:31:11,2020-04-18 15:28:54,,,,,,,,,,,,"National Alliance for Museums, Health and Wellbeing",,,,,,,,,,/home/diegodlh/Zotero/storage/K8WLILMW/museums-for-health-and-wellbeing.pdf,,,,,,,,,,,,,,,,,,,,,,,,,,,,,,,,,,,,,,,,,,,,,,,,,,['**CITED > ALREADY CITED > Section 1'],['**CITED'],True,False,False,False,False,"Professor of Biology, UCL Biosciences and Head of Research and Teaching, UCL Culture, University College London, Gower Street, London WC1E 6BT, UK","['Research Associate, Whitworth Art Gallery, University of Manchester and Honorary Researcher, UCL Culture, University College London, London, UK', 'Professor of Biology, UCL Biosciences and Head of Research and Teaching, UCL Culture, University College London, Gower Street, London WC1E 6BT, UK']","[['Research Associate, Whitworth Art Gallery, University of Manchester and Honorary Researcher, UCL Culture, University College London, London, UK'], ['Research Associate, Whitworth Art Gallery, University of Manchester and Honorary Researcher, UCL Culture, University College London, London, UK'], ['Professor of Biology, UCL Biosciences and Head of Research and Teaching, UCL Culture, University College London, Gower Street, London WC1E 6BT, UK'], ['Professor of Biology, UCL Biosciences and Head of Research and Teaching, UCL Culture, University College London, Gower Street, London WC1E 6BT, UK']]",4,10.1177/1757913917737588,,62.198067,,"Museums, health and wellbeing research: co-developing a new observational method for people with dementia in hospital contexts",
UT8RKGAI,blogPost,2015.0,"Thorp, Jer",A Sort of Joy,Medium,,,,https://medium.com/memo-random/a-sort-of-joy-1d9d5ff02ac9,"Performing MoMA’s 120,000 object collections database",2015-07-28,2020-04-18 14:02:33,2020-04-18 14:02:33,2018-09-16 11:05:01,,,,,,,,,,,,,,,,,,,,,,/home/diegodlh/Zotero/storage/52NGGXPG/a-sort-of-joy-1d9d5ff02ac9.html,,,,,,,,,,,,,,,,,,,,,,,,,,,,,,,,,,,,,,,,,,,,,,,,,,['**CITED > ALREADY CITED > Section 1'],['**CITED'],True,False,False,False,False,,,,,Error: Type not supported,,Error: Type not supported,,,
