Key,Item Type,Publication Year,Author,Title,Publication Title,ISBN,ISSN,DOI,Url,Abstract Note,Date,Date Added,Date Modified,Access Date,Pages,Num Pages,Issue,Volume,Number Of Volumes,Journal Abbreviation,Short Title,Series,Series Number,Series Text,Series Title,Publisher,Language,Rights,Type,Archive,Archive Location,Library Catalog,Call Number,Extra,Notes,File Attachments,Link Attachments,Manual Tags,Automatic Tags,Editor,Series Editor,Translator,Contributor,Attorney Agent,Book Author,Cast Member,Commenter,Composer,Cosponsor,Counsel,Interviewer,Producer,Recipient,Reviewed Author,Scriptwriter,Words By,Guest,Number,Edition,Running Time,Scale,Medium,Artwork Size,Filing Date,Application Number,Assignee,Issuing Authority,Country,Meeting Name,Conference Name,Court,References,Reporter,Legal Status,Priority Numbers,Programming Language,Version,System,Code,Code Number,Section,Session,Committee,History,Legislative Body,collections,root_collections,RC: **CITED,RC: White Paper Research,RC: Practical Guidance,RC: ADMIN,RC: *WORK IN,xref_affil_first_first,xref_affil_main,xref_affiliations,xref_author_count,xref_doi,xref_publisher_location,xref_score,xref_title,title,zotero_place
GIIS83DU,webpage,,,Open Access Initiative Values,Smithsonian Institution,,,,https://www.si.edu/openaccess/values,Learn more about Open Access Initiative Values,,2020-07-23 15:34:03,2020-07-23 15:34:03,2020-07-23 15:34:03,,,,,,,,,,,,,en,,,,,,,Library Catalog: www.si.edu,,/home/diegodlh/Zotero/storage/QQ2XY5DA/values.html,,,,,,,,,,,,,,,,,,,,,,,,,,,,,,,,,,,,,,,,,,,,,,,,,,['*WORK IN'],['*WORK IN'],False,False,False,False,True,,,,,Error: Type not supported,,Error: Type not supported,,,
5GB7XZZ2,webpage,,,Open Access FAQ,Smithsonian Institution,,,,https://www.si.edu/openaccess/faq,Learn more about Open Access FAQ,,2020-07-23 15:34:01,2020-07-23 15:34:01,2020-07-23 15:34:01,,,,,,,,,,,,,en,,,,,,,Library Catalog: www.si.edu,,/home/diegodlh/Zotero/storage/CT6S47CU/faq.html,,,,,,,,,,,,,,,,,,,,,,,,,,,,,,,,,,,,,,,,,,,,,,,,,,['*WORK IN'],['*WORK IN'],False,False,False,False,True,,,,,Error: Type not supported,,Error: Type not supported,,,
3WITW2C4,blogPost,2020.0,,A Symposium to Center Latin American and Caribbean Partners • CLIR,CLIR,,,,https://www.clir.org/2020/07/a-symposium-to-center-latin-american-and-caribbean-partners/,"This is part one of a two-part interview with the organizers of “Capacity Assessment of Latin American and Caribbean Partners: A Symposium about Open-Access, Technological Needs, and Institutional Sustainability,” which took place virtually April 16-17, 2020. Part two will be published tomorrow, July 14. In this piece, Nicole Kang Ferraiolo, CLIR’s Director of Global Strategic Initiatives, interviews:    Hadassah St. Hubert, CLIR Postdoctoral Fellow at Digital Library of the Caribbean at Florida International University Jennifer Isasi, Assistant Director of the Digital Pedagogy and Scholarship Office and Director of the Digital Liberal Arts Initiative at Penn State University Nicté Fuller Medina, CLIR Postdoctoral Fellow at the University of California, Los Angeles Libraries in Data Curation in Latin American and Caribbean Studies Margie Montañez, Humanities Librarian at the University of New Mexico and a previous CLIR fellow for Data Curation for Latin American and Caribbean Studies at UNM Can you provide a brief overview of the Latin American and Caribbean partners symposium? Hadassah St. Hubert: The full title was Capacity Assessment of Latin American and Caribbean Partners: A Symposium about Open Access, Technological Needs and Institutional Sustainability. The symposium was a microgrant project through CLIR’s Data Curation Fellowships in Latin American and Caribbean Studies, funded by the Mellon Foundation. The conference took place April 16th and 17th; it was initially intended to be an in-person event but was held via Zoom and live stream on Facebook because of COVID-19. The intended audience for the symposium was people who do post custodial archival work, our partners in Latin America and the Caribbean, and then funding institutions that support digitization projects in these areas. In total we had 126 people participating via Zoom and over 1,700 views on Facebook. Nicté Fuller Medina: It was for the cultural heritage institutions, libraries, and archives in Latin America and the Caribbean. It was about connecting them with resources and creating a space for a conversation with institutions in the US and Canada. Margie Montañez: At the end of the day, we had partners from six different countries: Mexico, Colombia, Haiti, Jamaica, Barbados, and the US. Jennifer Isasi: Also the keynote was in Argentina and the audience was also from several other countries.  What were the symposium’s goals? Margie Montañez: One of the major goals was to find out what the institutions in Latin America and in the Caribbean needed from their US partner institutions. A second goal was to talk with our partner institutions about technical capabilities. Third, we wanted to talk about who they see using their materials and how can we help them get these digitized materials to their intended audiences. Hadassah St. Hubert: We also wanted to create a set of guidelines and recommendations for libraries and archives in the US and Canada, and for those who fund these projects, based on the conversations at the symposium. Nicté Fuller Medina: The idea was to get insights from the institutions in the Caribbean and Latin America, so that these partnerships are more transparent, and so there was a platform for those voices. Because of the power dynamic between the so-called global North and global South, a lot of what happens relies on individual institutions. We wanted to be able to provide a broader picture. Jennifer Isasi: Another thing that we did is bring institutions together from the region. We found that they often don’t know each other, and by creating this group, they can now share information. What were some of the considerations you had in mind when designing it? Nicté Fuller Medina: One of the things that we wanted to do was to make sure that the invited institutions from the Caribbean and Latin America had a space to showcase the work that they were doing for an international audience. And then we wanted to put them in the same room with funders to demystify that whole process and put a face to funding programs. The microgrant we received was so important because it takes funding to be able to facilitate participation from the global South because of how the North-South divide operates. Hadassah St. Hubert: I just wanted to add a brief note about how we selected our keynotes. We did a survey of the Latin American and Caribbean partners before the symposium, and they were chosen as a result of the topics. Open access was one of their topics that they wanted to learn about and that’s why we chose Gimena del Rio Riande. Margie Montañez: We were very intentional about centering the voices from our partner institutions, so that it wasn’t about the needs of a US researcher or the needs of a US institution. What are the next steps for this project? Jennifer Isasi: We are developing guidelines and recommendations with different audiences in mind. We have a section for institutions in the global North that have an interest in digitizing and curating materials from Latin America and the Caribbean; we have a set of recommendations for institutions that are funding these projects, and one for the institutions in the Caribbean and Latin America. I will say that overall, the recommendation is that there be more communication and community creation among them. For instance, US and Canada-based institutions could reduce the burdens on Latin American and Caribbean partners by making paperwork easier or taking on the cost of translation work, particularly in the case of grant applications. Nicté Fuller Medina: We’ll be making these recommendations public along with the recordings of the sessions. We’re planning to translate them into Spanish, French, and possibly Portuguese. Jennifer has also started working on captioning for the videos. It’s important to us to translate what we are producing so that it’s accessible to institutions in Latin America and the Caribbean. The second part of this interview, focused on the impact of COVID-19 on the symposium, will be published tomorrow. Recordings of the symposium sessions can be found here. The forthcoming recommendations and guidelines are expected to be available in fall 2020 on the symposium Read More",2020-07-13,2020-07-23 15:33:55,2020-07-23 15:33:55,2020-07-23 15:33:55,,,,,,,,,,,,,en-US,,,,,,,Library Catalog: www.clir.org,,/home/diegodlh/Zotero/storage/SKNHREKR/a-symposium-to-center-latin-american-and-caribbean-partners.html,,,,,,,,,,,,,,,,,,,,,,,,,,,,,,,,,,,,,,,,,,,,,,,,,,['*WORK IN'],['*WORK IN'],False,False,False,False,True,,,,,Error: Type not supported,,Error: Type not supported,,,
3TPTGEPC,videoRecording,2020.0,,Photographing vulnerable populations: The ethics of protest coverage,,,,,https://www.youtube.com/watch?v=UsTzUy7jeBQ,"Brent Lewis, photo editor at the New York Times, Tara Pixley, assistant professor at Loyola Marymount University and Carlos Gonzalez, photojournalist at the San Francisco Chronicle, will lead a discussion moderated by Leah Millis, photojournalist at Reuters, on photographing vulnerable populations in public spaces and the ethics of protest coverage.",2020-07-10,2020-07-21 14:58:18,2020-07-21 14:58:18,2020-07-21 14:58:18,,,,,,,Photographing vulnerable populations,,,,,,,,,,,YouTube,,,,,,,,,,,,,,,,,,,,,,,,,,,,1:33:46,,,,,,,,,,,,,,,,,,,,,,,,,,['*WORK IN'],['*WORK IN'],False,False,False,False,True,,,,,Error: Type not supported,,Error: Type not supported,,,
IG692XEB,webpage,,,Ethical Explorer Pack – Tools to help manage the future impact of today’s tech,Ethical Explorer,,,,https://ethicalexplorer.org/,"The Ethical Explorer Pack is your go-to tool for building tech that values fundamental human rights, empowers users, and creates healthy online experiences.",,2020-07-21 12:08:04,2020-07-21 12:08:04,2020-07-21 12:08:04,,,,,,,,,,,,,en-US,,,,,,,Library Catalog: ethicalexplorer.org,,/home/diegodlh/Zotero/storage/E79NQ2SK/ethicalexplorer.org.html,,,,,,,,,,,,,,,,,,,,,,,,,,,,,,,,,,,,,,,,,,,,,,,,,,['*WORK IN'],['*WORK IN'],False,False,False,False,True,,,,,Error: Type not supported,,Error: Type not supported,,,
H47QRNSN,webpage,,,Data Protection and Historians | RHS,,,,,https://royalhistsoc.org/policy/data-protection-and-historians/,,,2020-07-21 10:16:21,2020-07-21 10:16:21,2020-07-21 10:16:21,,,,,,,,,,,,,,,,,,,,,,/home/diegodlh/Zotero/storage/TJCIBSW9/data-protection-and-historians.html,,,,,,,,,,,,,,,,,,,,,,,,,,,,,,,,,,,,,,,,,,,,,,,,,,['*WORK IN'],['*WORK IN'],False,False,False,False,True,,,,,Error: Type not supported,,Error: Type not supported,,,
YG6RT9NK,journalArticle,2000.0,"Burkett, Ingrid",Beyond the ‘information rich and poor’: futures understandings of inequality in globalising informational economies,Futures,,0016-3287,10.1016/S0016-3287(00)00016-1,http://www.sciencedirect.com/science/article/pii/S0016328700000161,"Much of the debate about inequality in globalising informational economies has focused on the future role of information in social development processes. This paper argues that there are five key erroneous assumptions about the nature of inequality in globalising informational economies which underpin much of this debate—both on an academic and popularist level. The paper argues that it is of fundamental importance that these assumptions are critically examined if the futures of communications policy and planning are to adequately address questions of inequality in relation to information, knowledge and communications. Indeed, failure to examine these assumptions may lead futurists and social scientists (particularly in the West) to become complicit in distracting attention away from the very ‘real’ global economic, social and cultural inequalities, to ‘virtual’ inequalities which merely hide an unwillingness to address the core failings of the ‘development’ paradigm.",2000-09-01,2020-07-20 18:40:21,2020-07-20 18:40:21,2020-07-20 18:40:21,679-694,,7,32.0,,Futures,Beyond the ‘information rich and poor’,,,,,,en,,,,,ScienceDirect,,,,/home/diegodlh/Zotero/storage/4UP3Q9VG/S0016328700000161.html,,,,,,,,,,,,,,,,,,,,,,,,,,,,,,,,,,,,,,,,,,,,,,,,,,['*WORK IN'],['*WORK IN'],False,False,False,False,True,,,Error: No affiliations provided,2,10.1016/S0016-3287(00)00016-1,,exact,,Beyond the ‘information rich and poor’: futures understandings of inequality in globalising informational economies,
285SHB3W,webpage,,,Podcasts,Voices to Hear,,,,https://voicestohearcdatribe.org/podcasts,,,2020-07-15 17:47:21,2020-07-15 17:47:21,2020-07-15 17:47:21,,,,,,,,,,,,,en-US,,,,,,,Library Catalog: voicestohearcdatribe.org,,/home/diegodlh/Zotero/storage/VS58RTWC/podcasts.html,,,,,,,,,,,,,,,,,,,,,,,,,,,,,,,,,,,,,,,,,,,,,,,,,,['*WORK IN'],['*WORK IN'],False,False,False,False,True,,,,,Error: Type not supported,,Error: Type not supported,,,
HIH37TEP,webpage,,,#metoo project Schlesinger Library,#metoo project Schlesinger Library,,,,https://www.schlesinger-metooproject-radcliffe.org,,,2020-07-09 17:09:26,2020-07-09 17:09:26,2020-07-09 17:09:26,,,,,,,,,,,,,en-US,,,,,,,Library Catalog: www.schlesinger-metooproject-radcliffe.org,,/home/diegodlh/Zotero/storage/SYK8F2K7/www.schlesinger-metooproject-radcliffe.org.html,,,,,,,,,,,,,,,,,,,,,,,,,,,,,,,,,,,,,,,,,,,,,,,,,,[],[],False,False,False,False,False,,,,,Error: Type not supported,,Error: Type not supported,,,
5UUVWZ5J,blogPost,,"Allahyari, Morehshin",Digital colonialism (2016-2019),,,,,http://www.morehshin.com/digital-colonialism-2016-2019/,"“Material Speculation” is a digital fabrication and 3D printing project by Morehshin Allahyari that inspects Petropolitical and poetic relationships between 3D Printing, Plastic, Oil, Technocapitalism and Jihad.",,2020-07-02 19:23:41,2020-07-02 19:24:58,,,,,,,,,,,,,,,,,,,,,,,,,,,,,,,,,,,,,,,,,,,,,,,,,,,,,,,,,,,,,,,,,,,,,,,,,['*WORK IN'],['*WORK IN'],False,False,False,False,True,,,,,Error: Type not supported,,Error: Type not supported,,,
LANWDUCV,journalArticle,2020.0,"Qureshi, Abdullah; Allahyari, Morehshin",On Digital Decolonization: A Conversation with Morehshin Allahyari,Frontiers: A Journal of Women Studies,,1536-0334,,http://muse.jhu.edu/article/755342,"In 2014 the Islamic State (ISIS/ISIL) began ruthless destruction of ancient and historical heritage, including sites as old as 3,000 years, in Iraq and Syria. A year later the world witnessed this through horrifying videos on social media. Responding to this unimaginable cultural loss, Iranian-born artist and activist Morehshin Allahyari initiated Material Speculation: Isis—creating 3D-printed replicas of twelve of the destroyed sculptures from the cities of Hatra and Nineveh. The project involved collecting extensive data and research with various historians, curators, and visual archives, which Allahyari placed on USB flash drives and embedded within the body of the statues. In her current series, She Who Sees the Unknown, she looks at stories from the South West Asian and North African (SWANA) region, re-figuring images of goddesses and djinns through a feminist lens as a way of weaving new magical narratives and speculating mythologies., In this conversation with Allahyari, I discuss her artistic and research processes, unpacking issues of digital decolonization. The dialogue further addresses the philosophical underpinnings of her practice and looks at the use of technology as a means to reflect and challenge our collective political, social, and cultural pasts, presents, and futures.",2020-05-19,2020-07-02 19:22:24,2020-07-02 19:22:24,2020-06-19 22:24:56,87-100,,1,41.0,,,On Digital Decolonization,,,,,,en,,,,,Project MUSE,,Publisher: University of Nebraska Press,,,,,,,,,,,,,,,,,,,,,,,,,,,,,,,,,,,,,,,,,,,,,,,,,,,,['*WORK IN'],['*WORK IN'],False,False,False,False,True,,,Error: No affiliations provided,2,10.5250/fronjwomestud.41.1.0087,,93.58119,,On Digital Decolonization: A Conversation with Morehshin Allahyari,
UL6NTPK7,webpage,,,"Race, Diversity and Politics in Conservation: Our 21st Century Crisis–Sanchita Balachandran – AIC Blog Archives: Conservators Converse",,,,,http://resources.culturalheritage.org/conservators-converse/2016/05/25/race-diversity-and-politics-in-conservation-our-21st-century-crisis-sanchita-balachandran/,,,2020-07-01 10:49:04,2020-07-01 10:49:04,2020-06-29 16:06:08,,,,,,,,,,,,,,,,,,,,,,/home/diegodlh/Zotero/storage/SNQMS8YU/race-diversity-and-politics-in-conservation-our-21st-century-crisis-sanchita-balachandran.html,,,,,,,,,,,,,,,,,,,,,,,,,,,,,,,,,,,,,,,,,,,,,,,,,,['*WORK IN'],['*WORK IN'],False,False,False,False,True,,,,,Error: Type not supported,,Error: Type not supported,,,
8YQVCMKP,webpage,,,"Creative Commons on Twitter: ""🎙️ Thanks to the efforts of CC Certificate facilitator Jonathan A Poritz (an #OER enthusiast) our training materials are now available as audio files licensed CC BY 4.0! https://t.co/bcqyt8KfL8"" / Twitter",Twitter,,,,https://twitter.com/creativecommons/status/1276160573928071176,,,2020-06-29 06:32:27,2020-06-29 06:32:27,2020-06-29 06:32:27,,,,,,,Creative Commons on Twitter,,,,,,en-GB,,,,,,,Library Catalog: twitter.com,,/home/diegodlh/Zotero/storage/PEKXF388/1276160573928071176.html,,,,,,,,,,,,,,,,,,,,,,,,,,,,,,,,,,,,,,,,,,,,,,,,,,['*WORK IN'],['*WORK IN'],False,False,False,False,True,,,,,Error: Type not supported,,Error: Type not supported,,,
E5TPPPZL,webpage,,,Home Page,Open Preservation Foundation,,,,https://openpreservation.org/,News,,2020-06-29 06:29:39,2020-06-29 06:29:39,2020-06-29 06:29:39,,,,,,,,,,,,,en-GB,,,,,,,Library Catalog: openpreservation.org,,/home/diegodlh/Zotero/storage/T2D79ZHQ/openpreservation.org.html,,,,,,,,,,,,,,,,,,,,,,,,,,,,,,,,,,,,,,,,,,,,,,,,,,['*WORK IN'],['*WORK IN'],False,False,False,False,True,,,,,Error: Type not supported,,Error: Type not supported,,,
WNMNH6SX,webpage,,,"P. Gabrielle Foreman on Twitter: ""Harvard’s @HoughtonLib will pause all digital project work to spend the year digitizing *only #BlackHistory.* Why? Because an archivist dared to propose it when undergirded by a movement.💥@dorothyjberry!💥 @BC_ALA @NYPL_Archives @AmAntiquarian @BeineckeLibrary @TranscribeSI"" / Twitter",Twitter,,,,https://twitter.com/profgabrielle/status/1276230972535648256,,,2020-06-29 06:28:25,2020-06-29 06:28:25,2020-06-29 06:28:25,,,,,,,P. Gabrielle Foreman on Twitter,,,,,,en-GB,,,,,,,Library Catalog: twitter.com,,/home/diegodlh/Zotero/storage/8NJJ6J4K/1276230972535648256.html,,,,,,,,,,,,,,,,,,,,,,,,,,,,,,,,,,,,,,,,,,,,,,,,,,['*WORK IN'],['*WORK IN'],False,False,False,False,True,,,,,Error: Type not supported,,Error: Type not supported,,,
V4RFLGXX,webpage,,,"Lisette Kalshoven on Twitter: ""Great pop-up on the new @TroveAustralia website. It gives the option to receive cultural context at some descriptions / works / opinions that we may not find appropriate anymore. I am clicking 'yes, show me!' #OpenGlam #OpenHeritage https://t.co/iiUZ6rdcFF"" / Twitter",Twitter,,,,https://twitter.com/lnkalshoven/status/1276429023376289792,,,2020-06-29 06:28:01,2020-06-29 06:28:01,2020-06-29 06:28:01,,,,,,,Lisette Kalshoven on Twitter,,,,,,en-GB,,,,,,,Library Catalog: twitter.com,,/home/diegodlh/Zotero/storage/GULDWZSF/1276429023376289792.html,,,,,,,,,,,,,,,,,,,,,,,,,,,,,,,,,,,,,,,,,,,,,,,,,,['*WORK IN'],['*WORK IN'],False,False,False,False,True,,,,,Error: Type not supported,,Error: Type not supported,,,
H3MUAVEH,webpage,,,Starting a Digital Collection | U-M Library,,,,,https://www.lib.umich.edu/digital-content-collections-dcc/starting-digital-collection,,,2020-06-29 05:57:36,2020-06-29 05:57:36,2020-06-29 05:57:36,,,,,,,,,,,,,,,,,,,,,,/home/diegodlh/Zotero/storage/UAENBBUQ/starting-digital-collection.html,,,,,,,,,,,,,,,,,,,,,,,,,,,,,,,,,,,,,,,,,,,,,,,,,,['*WORK IN'],['*WORK IN'],False,False,False,False,True,,,,,Error: Type not supported,,Error: Type not supported,,,
AAN6AAYE,webpage,2020.0,,On the Limits of Care and Knowledge: 15 Points Museums Must Understand to Dismantle Structural Injustice,artnet News,,,,https://news.artnet.com/opinion/limits-of-care-and-knowledge-yesomi-umolu-op-ed-1889739,The artistic director of the 2019 Chicago Architecture Biennial explores what museums must internalize before moving forward.,2020-06-25,2020-06-29 05:55:48,2020-06-29 05:55:48,2020-06-29 05:55:48,,,,,,,On the Limits of Care and Knowledge,,,,,,en-US,,,,,,,Library Catalog: news.artnet.com Section: Opinion,,/home/diegodlh/Zotero/storage/8A4LREF3/limits-of-care-and-knowledge-yesomi-umolu-op-ed-1889739.html,,,,,,,,,,,,,,,,,,,,,,,,,,,,,,,,,,,,,,,,,,,,,,,,,,['*WORK IN'],['*WORK IN'],False,False,False,False,True,,,,,Error: Type not supported,,Error: Type not supported,,,
GYIK5UHG,blogPost,2020.0,,To Bear Witness: Real Talk about White Supremacy in Art Museums Today,Burnaway,,,,https://burnaway.org/to-bear-witness/,"After years of working in art museums in the United States, Dr. Kelli Morgan outlines her experiences of institutional racism and how to fix it.",2020-06-24,2020-06-29 05:55:46,2020-06-29 05:55:46,2020-06-29 05:55:46,,,,,,,To Bear Witness,,,,,,en-US,,,,,,,Library Catalog: burnaway.org Section: Feature,,/home/diegodlh/Zotero/storage/X73XGFAD/to-bear-witness.html,,,,,,,,,,,,,,,,,,,,,,,,,,,,,,,,,,,,,,,,,,,,,,,,,,['*WORK IN'],['*WORK IN'],False,False,False,False,True,,,,,Error: Type not supported,,Error: Type not supported,,,
RSJNCTG2,webpage,,"Chan, Sebastian",48. On Planetary in 2020: curatorial activism and open sourcing in service of digital preservation,,,,,https://sebchan.substack.com/p/48-on-planetary-in-2020-curatorial,"The first I knew of Kemal Enver’s work on Planetary was an excited message from Aaron. And there it was, live on the AppStore — Planetary Remastered. I got in touch with Kemal, not aware that he was based in Sydney. I was really curious as to how he came across Planetary and what he had done to bring it back to life.",,2020-06-29 05:50:59,2020-06-29 05:50:59,2020-06-29 05:50:59,,,,,,,48. On Planetary in 2020,,,,,,,,,,,,,Library Catalog: sebchan.substack.com,,/home/diegodlh/Zotero/storage/DZKULKAG/48-on-planetary-in-2020-curatorial.html,,,,,,,,,,,,,,,,,,,,,,,,,,,,,,,,,,,,,,,,,,,,,,,,,,['*WORK IN'],['*WORK IN'],False,False,False,False,True,,,,,Error: Type not supported,,Error: Type not supported,,,
9J8KR6AK,webpage,2020.0,,Community Calls on ICP to Set Ethical Guidelines for Protest Photography,Hyperallergic,,,,https://hyperallergic.com/572749/community-calls-on-icp-to-set-ethical-guidelines-for-protest-photography/,"Noah Morrison, founding member of ICP Center Blackness Now, says the International Center of Photography’s response to their efforts has been superficial.",2020-06-23,2020-06-26 10:31:34,2020-06-26 10:31:34,2020-06-26 10:31:34,,,,,,,,,,,,,en-US,,,,,,,Library Catalog: hyperallergic.com,,/home/diegodlh/Zotero/storage/7897S7F2/community-calls-on-icp-to-set-ethical-guidelines-for-protest-photography.html,,,,,,,,,,,,,,,,,,,,,,,,,,,,,,,,,,,,,,,,,,,,,,,,,,['*WORK IN'],['*WORK IN'],False,False,False,False,True,,,,,Error: Type not supported,,Error: Type not supported,,,
VS3LBZX5,blogPost,,,"Race, Policing, and Detroit’s Project Green Light – UM ESC",,,,,http://esc.umich.edu/project-green-light/,,,2020-06-26 10:31:33,2020-06-26 10:31:33,2020-06-26 10:31:33,,,,,,,,,,,,,en-US,,,,,,,Library Catalog: esc.umich.edu,,/home/diegodlh/Zotero/storage/SBEG25W9/project-green-light.html,,,,,,,,,,,,,,,,,,,,,,,,,,,,,,,,,,,,,,,,,,,,,,,,,,['*WORK IN'],['*WORK IN'],False,False,False,False,True,,,,,Error: Type not supported,,Error: Type not supported,,,
P26SARX5,webpage,2014.0,acmonk,Copyright & ethical terms of reuse,,,,,https://www.qdl.qa/en/copyright-ethical-terms-reuse,Copyright & ethical terms of reuse,2014-08-21,2020-06-25 15:38:25,2020-06-25 15:38:25,2020-06-25 15:38:25,,,,,,,,,,,,,English,,Text,,,,,Library Catalog: www.qdl.qa,,/home/diegodlh/Zotero/storage/MNWW4BVT/copyright-ethical-terms-reuse.html,,,,,,,,,,,,,,,,,,,,,,,,,,,,,,,,,,,,,,,,,,,,,,,,,,['*WORK IN'],['*WORK IN'],False,False,False,False,True,,,,,Error: Type not supported,,Error: Type not supported,,,
HNJ382Z2,webpage,,,ResponsibleAccessWorkflows_PUBLIC_CC-BY-NC-4.0,Google Docs,,,,https://docs.google.com/presentation/d/1V66PGpIq9xqXxdvngpD3rkAMoIw2hIyVVDS4Iv4VFOM/edit?usp=embed_facebook,Updated 28 Apr. 2020 Not Legal Advice RESPONSIBLE ACCESS WORKFLOWS Copyright © The Regents of the University of California. Licensed CC-BY-NC 4.0,,2020-06-25 14:51:20,2020-06-25 14:51:20,2020-06-25 14:51:20,,,,,,,,,,,,,en,,,,,,,Library Catalog: docs.google.com,,/home/diegodlh/Zotero/storage/6EFL4TEF/edit.html,,,,,,,,,,,,,,,,,,,,,,,,,,,,,,,,,,,,,,,,,,,,,,,,,,['*WORK IN'],['*WORK IN'],False,False,False,False,True,,,,,Error: Type not supported,,Error: Type not supported,,,
X253B3GW,webpage,2020.0,"Summers, Ed",Introducing The Catalog v2,Medium,,,,https://news.docnow.io/introducing-the-catalog-v2-80557eeb8421,If you’ve been following our work for the past few years you may have occasionally seen us mention something called the Catalog. The…,2020-04-16,2020-06-24 12:22:43,2020-06-24 12:22:43,2020-06-24 12:22:43,,,,,,,,,,,,,en,,,,,,,Library Catalog: news.docnow.io,,/home/diegodlh/Zotero/storage/DVZUUF68/introducing-the-catalog-v2-80557eeb8421.html,,,,,,,,,,,,,,,,,,,,,,,,,,,,,,,,,,,,,,,,,,,,,,,,,,['*WORK IN'],['*WORK IN'],False,False,False,False,True,,,,,Error: Type not supported,,Error: Type not supported,,,
